PT	AU	BA	BE	GP	AF	BF	CA	TI	SO	SE	BS	LA	DT	CT	CY	CL	SP	HO	DE	ID	AB	C1	RP	EM	RI	OI	FU	FX	CR	NR	TC	Z9	U1	U2	PU	PI	PA	SN	EI	BN	J9	JI	PD	PY	VL	IS	PN	SU	SI	MA	BP	EP	AR	DI	D2	PG	WC	SC	GA	UT	PM	OA	HC	HP	DA	Source	Conference	Issn	PaysENG_I	PaysENG_C	PaysENG_R	PaysFRE_R	PaysISO3
J	Karouzos, M; Im, M; Trichas, M; Goto, T; Malkan, M; Ruiz, A; Jeon, Y; Kim, JH; Lee, HM; Kim, SJ; Oi, N; Matsuhara, H; Takagi, T; Murata, K; Wada, T; Wada, K; Shim, H; Hanami, H; Serjeant, S; White, GJ; Pearson, C; Ohyama, Y				Karouzos, Marios; Im, Myungshin; Trichas, Markos; Goto, Tomo; Malkan, Matt; Ruiz, Angel; Jeon, Yiseul; Kim, Ji Hoon; Lee, Hyung Mok; Kim, Seong Jin; Oi, Nagisa; Matsuhara, Hideo; Takagi, Toshinobu; Murata, K.; Wada, Takehiko; Wada, Kensuke; Shim, Hyunjin; Hanami, Hitoshi; Serjeant, Stephen; White, Glenn J.; Pearson, Chris; Ohyama, Youichi			A TALE OF TWO FEEDBACKS: STAR FORMATION IN THE HOST GALAXIES OF RADIO AGNs	ASTROPHYSICAL JOURNAL			English	Article						galaxies: active; galaxies: evolution; galaxies: jets; galaxies: star formation; galaxies: statistics	ACTIVE GALACTIC NUCLEI; SUPERMASSIVE BLACK-HOLES; NORTH ECLIPTIC POLE; SPECTRAL ENERGY-DISTRIBUTIONS; DIGITAL-SKY-SURVEY; MIDINFRARED SOURCE CATALOG; SIMILAR-TO 2.5; X-RAY SURVEYS; FORMING GALAXIES; DEEP SURVEY	Several lines of argument support the existence of a link between activity at the nuclei of galaxies, in the form of an accreting supermassive black hole, and star formation activity in these galaxies. Radio jets have long been argued to be an ideal mechanism that allows active galactic nuclei (AGNs) to interact with their host galaxies and affect star formation. We use a sample of radio sources in the North Ecliptic Pole (NEP) field to study the nature of this putative link, by means of spectral energy distribution (SED) fitting. We employ the excellent spectral coverage of the AKARI infrared space telescope and the rich ancillary data available in the NEP to build SEDs extending from UV to far-IR wavelengths. We find a significant AGN component in our sample of relatively faint radio sources (<mJy). A positive correlation is found between the luminosity of the AGN component and that of star formation in the host galaxy, independent of the radio luminosity. In contrast, for narrow redshift and AGN luminosity ranges, we find that increasing radio luminosity leads to a decrease in the specific star formation rate. The most radio-loud AGNs are found to lie on the main sequence of star formation for their respective redshifts. For the first time, we potentially see such a two-sided feedback process in the same sample. We discuss the possible suppression of star formation, but not total quenching, in systems with strong radio jets, that supports the maintenance nature of feedback from radio AGN jets.	[Karouzos, Marios; Im, Myungshin; Jeon, Yiseul; Kim, Ji Hoon] Seoul Natl Univ, CEOU Astron Program, Dept Phys & Astron, Seoul, South Korea; [Trichas, Markos] Airbus Def & Space, Stevenage SG1 2AS, Herts, England; [Goto, Tomo] Univ Copenhagen, Niels Bohr Inst, Dark Cosmol Ctr, DK-2100 Copenhagen, Denmark; [Malkan, Matt] Div Astron & Astrophys, Los Angeles, CA 90095 USA; [Ruiz, Angel] IUCAA, Pune 411007, Maharashtra, India; [Lee, Hyung Mok; Kim, Seong Jin] Seoul Natl Univ, Dept Phys & Astron, Astron Program, Seoul, South Korea; [Oi, Nagisa; Matsuhara, Hideo; Takagi, Toshinobu; Murata, K.; Wada, Takehiko; Wada, Kensuke] JAXA, Inst Space & Astronaut Sci, Sagamihara, Kanagawa 2298510, Japan; [Shim, Hyunjin] Kyungpook Natl Univ, Dept Earth Sci Educ, Taegu 702701, South Korea; [Hanami, Hitoshi] Iwate Univ, Phys Sect, Fac Humanities, Morioka, Iwate 0208550, Japan; [Serjeant, Stephen; White, Glenn J.; Pearson, Chris] Open Univ, Dept Phys & Astron, Milton Keynes MK7 6AA, Bucks, England; [White, Glenn J.; Pearson, Chris] Rutherford Appleton Lab, RALSpace, Sci & Technol Facil Council, Didcot OX11 0NL, Oxon, England; [Ohyama, Youichi] Acad Sinica, Inst Astron & Astrophys ASIAA, Taipei 10617, Taiwan	Karouzos, M (reprint author), Seoul Natl Univ, CEOU Astron Program, Dept Phys & Astron, Seoul, South Korea.	mkarouzos@astro.snu.ac.kr	Kim, Ji Hoon/A-8989-2009; Ruiz, Angel/B-4914-2008	Kim, Ji Hoon/0000-0002-1418-3309; Ruiz, Angel/0000-0002-3352-4383; Im, Myungshin/0000-0002-8537-6714	National Research Foundation of Korea (NRF) - Korean government (MSIP) [2008-0060544]; National Aeronautics and Space Administration	We thank the anonymous referee whose comments have significantly improved this manuscript. M. K. thanks Mar Mezcua for interesting discussions that have improved this manuscript. This work was supported by the National Research Foundation of Korea (NRF) grant No. 2008-0060544, funded by the Korean government (MSIP). This research is based on observations with AKARI, a JAXA project with the participation of ESA. This publication makes use of data products from the Wide-field Infrared Survey Explorer, which is a joint project of the University of California, Los Angeles, and the Jet Propulsion Laboratory/California Institute of Technology, funded by the National Aeronautics and Space Administration. This research has made use of NASA's Astrophysics Data System Bibliographic Services. This research has also made use of the NASA/IPAC Infrared Science Archive, which is operated by the Jet Propulsion Laboratory, California Institute of Technology, under contract with the National Aeronautics and Space Administration.		160	20	20	0	7	IOP PUBLISHING LTD	BRISTOL	TEMPLE CIRCUS, TEMPLE WAY, BRISTOL BS1 6BE, ENGLAND	0004-637X	1538-4357		ASTROPHYS J	Astrophys. J.	APR 1	2014	784	2							137	10.1088/0004-637X/784/2/137		23	Astronomy & Astrophysics	Astronomy & Astrophysics	AG6HJ	WOS:000335519400052		No			2017-09-26	ASTROPHYSICAL JOURNAL Volume: 784 Issue: 2 Article Number: 137 DOI: 10.1088/0004-637X/784/2/137 Published: 2014		0004-637X eISSN: 1538-4357	Denmark; India; Japan; South Korea; Taiwan; England; USA	Denmark; India; Japan; South Korea; Taiwan; England; United States	Denmark; India; Japan; South Korea; Taiwan; United Kingdom; United States	Danemark; Inde; Japon; Corée, République de; Taïwan, Province de Chine; Royaume-Uni; Etats-Unis	DNK; IND; JPN; KOR; TWN; GBR; USA
J	Fossati, L; Zwintz, K; Castro, N; Langer, N; Lorenz, D; Schneider, FRN; Kuschnig, R; Matthews, JM; Alecian, E; Wade, GA; Barnes, TG; Thoul, AA				Fossati, L.; Zwintz, K.; Castro, N.; Langer, N.; Lorenz, D.; Schneider, F. R. N.; Kuschnig, R.; Matthews, J. M.; Alecian, E.; Wade, G. A.; Barnes, T. G.; Thoul, A. A.			Two spotted and magnetic early B-type stars in the young open cluster NGC 2264 discovered by MOST and ESPaDOnS	ASTRONOMY & ASTROPHYSICS			English	Article						stars: fundamental parameters; stars: early-type; stars: individual: HD 47887; stars: individual: HD 47777; open clusters and associations: individual: NGC 2264; stars: magnetic field	LINE-DATA-BASE; ATMOSPHERIC NLTE-MODELS; UVBY-BETA PHOTOMETRY; MAIN-SEQUENCE STARS; MASSIVE STARS; ROTATIONAL VELOCITIES; EFFECTIVE TEMPERATURE; BLUE STARS; SPECTROSCOPIC ANALYSIS; ABUNDANCE ANALYSIS	Star clusters are known as superb tools for understanding stellar evolution. In a quest for understanding the physical origin of magnetism and chemical peculiarity in about 7% of the massive main-sequence stars, we analysed two of the ten brightest members of the similar to 10 Myr old Galactic open cluster NGC 2264, the early B-dwarfs HD47887 and HD47777. We find accurate rotation periods of 1.95 and 2.64 days, respectively, from MOST photometry. We obtained ESPaDOnS spectropolarimetric observations, through which we determined stellar parameters, detailed chemical surface abundances, projected rotational velocities, and the inclination angles of the rotation axis. Because we found only small (<5 km s(-1)) radial velocity variations, most likely caused by spots, we can rule out that HD47887 and HD47777 are close binaries. Finally, using the least-squares deconvolution technique, we found that both stars possess a large-scale magnetic field with an average longitudinal field strength of about 400 G. From a simultaneous fit of the stellar parameters we determine the evolutionary masses of HD47887 and HD47777 to be 9.4(-0.7)(+0.6) M-circle dot and 7.6(-0.5)(+0.5) M-circle dot. Interestingly, HD47777 shows a remarkable helium underabundance, typical of helium-weak chemically peculiar stars, while the abundances of HD47887 are normal, which might imply that diffusion is operating in the lower mass star but not in the slightly more massive one. Furthermore, we argue that the rather slow rotation, as well as the lack of nitrogen enrichment in both stars, can be consistent with both the fossil and the binary hypothesis for the origin of the magnetic field. However, the presence of two magnetic and apparently single stars near the top of the cluster mass-function may speak in favour of the latter.	[Fossati, L.; Castro, N.; Langer, N.; Schneider, F. R. N.] Univ Bonn, Argelander Inst Astron, D-53121 Bonn, Germany; [Zwintz, K.] Katholieke Univ Leuven, Inst Sterrenkunde, B-3001 Louvain, Belgium; [Lorenz, D.; Kuschnig, R.] Univ Vienna, Dept Astron, A-1180 Vienna, Austria; [Matthews, J. M.] Univ British Columbia, Dept Phys & Astron, Vancouver, BC V6T 1Z1, Canada; [Alecian, E.] UJF Grenoble 1 CNRS INSU, IPAG, UMR 5274, F-38041 Grenoble, France; [Alecian, E.] Univ Paris Diderot, UPMC Univ, CNRS, LESIA Observ Paris, F-92195 Meudon, France; [Wade, G. A.] Royal Mil Coll Canada, Dept Phys, Kingston, ON K7K 7B4, Canada; [Barnes, T. G.] Univ Texas Austin, McDonald Observ, Austin, TX 79734 USA; [Thoul, A. A.] Univ Liege, Inst Astrophys & Geophys, B-4000 Liege, Belgium	Fossati, L (reprint author), Univ Bonn, Argelander Inst Astron, Hugel 71, D-53121 Bonn, Germany.	lfossati@astro.uni-bonn.de	Castro, Norberto/L-2852-2017	Castro, Norberto/0000-0003-0521-473X; Zwintz, Konstanze/0000-0001-9229-8315	European Research Council under the European Community [227224]; Research Council of the K.U. Leuven [GOA/2013/012]; Research Foundation Flanders (FWO); Natural Sciences and Engineering Research Council of Canada (NSERC); Funds for Scientific Research of Flanders (FWO), Belgium; Research Council of K. U. Leuven, Belgium; Fonds National Recherches Scientific (FNRS), Belgium; Royal Observatory of Belgium; Observatoire de Geneve, Switzerland; Thuringer Landessternwarte Tautenburg, Germany	The research leading to these results has received funding from the European Research Council under the European Community's Seventh Framework Programme (FP7/2007-2013)/ERC grant agreement No. 227224 (PROSPERITY). This research is (partially) funded by the Research Council of the K.U. Leuven under grant agreement GOA/2013/012. K.Z. received a Pegasus Marie Curie Fellowship of the Research Foundation Flanders (FWO) during part of this work. G. A. W. acknowledges support from the Natural Sciences and Engineering Research Council of Canada (NSERC). A.A.T. is a Chercheur Qualifie FNRS. Spectroscopic data were obtained with the 2.7 m telescope at Mc Donald Observatory, Texas, US. Based on observations made with the Mercator Telescope, operated on the island of La Palma by the Flemish Community, at the Spanish Observatorio del Roque de los Muchachos of the Instituto de Astrofisica de Canarias. Based on observations obtained with the HERMES spectrograph, which is supported by the Funds for Scientific Research of Flanders (FWO), Belgium, the Research Council of K. U. Leuven, Belgium, the Fonds National Recherches Scientific (FNRS), Belgium, the Royal Observatory of Belgium, the Observatoire de Geneve, Switzerland and the Thuringer Landessternwarte Tautenburg, Germany. Use was made of the WEBDA database of open clusters developed and maintained by E. Paunzen, C. Stutz and J. Janik at the Department of Theoretical Physics and Astrophysics of the Masaryk University, Brno, Czech Republic. We would also like to thank P. Beck and P. Degroote for fruitful discussions, A. Moffat for useful comments on the manuscript, and E. Paunzen and I. Muller for their support in the preparation of this work.		113	12	12	0	1	EDP SCIENCES S A	LES ULIS CEDEX A	17, AVE DU HOGGAR, PA COURTABOEUF, BP 112, F-91944 LES ULIS CEDEX A, FRANCE	1432-0746			ASTRON ASTROPHYS	Astron. Astrophys.	FEB	2014	562								A143	10.1051/0004-6361/201323214		12	Astronomy & Astrophysics	Astronomy & Astrophysics	AC0CG	WOS:000332161800153		No			2017-09-26	ASTRONOMY & ASTROPHYSICS Volume: 562 Article Number: A143 DOI: 10.1051/0004-6361/201323214 Published: 2014		1432-0746	Austria; Belgium; Canada; France; Germany; USA	Austria; Belgium; Canada; France; Germany; United States	Austria; Belgium; Canada; France; Germany; United States	Autriche; Belgique; Canada; France; Allemagne; Etats-Unis	AUT; BEL; CAN; FRA; DEU; USA
J	Van Waerbeke, L; Hinshaw, G; Murray, N				Van Waerbeke, Ludovic; Hinshaw, Gary; Murray, Norman			Detection of warm and diffuse baryons in large scale structure from the cross correlation of gravitational lensing and the thermal Sunyaev-Zeldovich effect	PHYSICAL REVIEW D			English	Article							HOT INTERGALACTIC MEDIUM; DIGITAL SKY SURVEY; GALAXY CLUSTERS; MISSING BARYONS; STELLAR MASS; FRACTIONS; CATALOG	We report the first detection of a correlation between gravitational lensing by large scale structure and the thermal Sunyaev-Zeldovich ( tSZ) effect. Using the mass map from the Canada France Hawaii Telescope Lensing Survey and a newly constructed tSZ map from Planck, we measure a nonzero correlation between the two maps out to one degree angular separation on the sky, with an overall significance of 6 sigma. The tSZ maps are formed in a manner that removes primary cosmic microwave background fluctuations and minimizes residual contamination by galactic and extragalactic dust emission, and by CO line emission. We perform numerous tests to show that our measurement is immune to these residual contaminants. The resulting correlation function is consistent with the existence of a warm baryonic gas tracing the large scale structure with a bias b(gas). Given the shape of the lensing kernel, our signal sensitivity peaks at a redshift z similar to 0.4, where half a degree separation on the sky corresponds to a physical scale of similar to 10 Mpc. The amplitude of the signal constrains the product (b(gas)/1)(T-e/0.1 keV)((n) over bar (e)/1 m(-3)) = 2.01 +/- 0.31 +/- 0.21, at redshift zero. Our study suggests that a substantial fraction of the "missing" baryons in the Universe may reside in a low-density warm plasma that traces dark matter.	[Van Waerbeke, Ludovic; Hinshaw, Gary] Univ British Columbia, Dept Phys & Astron, Vancouver, BC V6T 1Z1, Canada; [Murray, Norman] Univ Toronto, Canadian Inst Theoret Astrophys, Toronto, ON M5S 3H8, Canada; [Murray, Norman] Canada Res Chair Theoret Astrophys, Toronto, ON, Canada	Van Waerbeke, L (reprint author), Univ British Columbia, Dept Phys & Astron, 6224 Agr Rd, Vancouver, BC V6T 1Z1, Canada.	waerbeke@phas.ubc.ca; hinshaw@phas.ubc.ca; murray@cita.utotonto.ca			Natural Sciences and Engineering Research Council of Canada (NSERC); Canadian Institute for Advanced Research (CIfAR); NSERC; CIfAR; Canada Research Chairs program; National Science Foundation [PHYS-1066293]; ESA Member States; NASA; Canadian Space Agency	L. V. W. is supported by the Natural Sciences and Engineering Research Council of Canada (NSERC) and the Canadian Institute for Advanced Research (CIfAR). G. H. and N. M. are supported by NSERC, CIfAR and by the Canada Research Chairs program. We thank Francois Bouchet for useful discussion about the Planck data. We thank the CFHTLenS team for making their catalogs publicly available to download http://www.cfhtlens.org. This work was supported in part by the National Science Foundation under Grant No. PHYS-1066293 and the hospitality of the Aspen Center for Physics. This work is partly based on observations obtained with Planck (http://www.esa.int/Planck), an ESA science mission with instruments and contributions directly funded by ESA Member States, NASA, and Canada. This work is also partly based on observations obtained with MegaPrime/MegaCam, a joint project of CFHT and CEA/IRFU, at the Canada-France-Hawaii Telescope (CFHT) which is operated by the National Research Council (NRC) of Canada, the Institut National des Sciences de lUnivers of the Centre National de la Recherche Scientifique (CNRS) of France, and the University of Hawaii. This research used the facilities of the Canadian Astronomy Data Centre operated by the National Research Council of Canada with the support of the Canadian Space Agency. CFHTLenS data processing was made possible thanks to significant computing support from the NSERC Research Tools and Instruments grant program.		35	31	31	0	2	AMER PHYSICAL SOC	COLLEGE PK	ONE PHYSICS ELLIPSE, COLLEGE PK, MD 20740-3844 USA	1550-7998	1550-2368		PHYS REV D	Phys. Rev. D	JAN 13	2014	89	2							023508	10.1103/PhysRevD.89.023508		8	Astronomy & Astrophysics; Physics, Particles & Fields	Astronomy & Astrophysics; Physics	AB5RK	WOS:000331845900002		No			2017-09-26	PHYSICAL REVIEW D Volume: 89 Issue: 2 Article Number: 023508 DOI: 10.1103/PhysRevD.89.023508 Published: 2014		1550-7998 eISSN: 1550-2368	Canada	Canada	Canada	Canada	CAN
J	Liu, MC; Magnier, EA; Deacon, NR; Allers, KN; Dupuy, TJ; Kotson, MC; Aller, KM; Burgett, WS; Chambers, KC; Draper, PW; Hodapp, KW; Jedicke, R; Kaiser, N; Kudritzki, RP; Metcalfe, N; Morgan, JS; Price, PA; Tonry, JL; Wainscoat, RJ				Liu, Michael C.; Magnier, Eugene A.; Deacon, Niall R.; Allers, Katelyn N.; Dupuy, Trent J.; Kotson, Michael C.; Aller, Kimberly M.; Burgett, W. S.; Chambers, K. C.; Draper, P. W.; Hodapp, K. W.; Jedicke, R.; Kaiser, N.; Kudritzki, R. -P.; Metcalfe, N.; Morgan, J. S.; Price, P. A.; Tonry, J. L.; Wainscoat, R. J.			THE EXTREMELY RED, YOUNG L DWARF PSO J318.5338-22.8603: A FREE-FLOATING PLANETARY-MASS ANALOG TO DIRECTLY IMAGED YOUNG GAS-GIANT PLANETS	ASTROPHYSICAL JOURNAL LETTERS			English	Article						brown dwarfs; parallaxes; planets and satellites: atmospheres; proper motions; solar neighborhood; surveys	NEAR-INFRARED SPECTRA; PROPER-MOTION SURVEY; HR 8799 PLANETS; FIELD L-DWARFS; BROWN DWARFS; T-DWARFS; ULTRACOOL DWARFS; MODEL ATMOSPHERES; MOVING GROUP; COOL NEIGHBORS	We have discovered using Pan-STARRS1 an extremely red late-L dwarf, which has (J - K)(MKO) = 2.78 and (J - K) (2MASS) = 2.84, making it the reddest known field dwarf and second only to 2MASS J1207-39b among substellar companions. Near-IR spectroscopy shows a spectral type of L7 +/- 1 and reveals a triangular H-band continuum and weak alkali (K I and Na I) lines, hallmarks of low surface gravity. Near-IR astrometry from the Hawaii Infrared Parallax Program gives a distance of 24.6 +/- 1.4 pc and indicates a much fainter J-band absolute magnitude than field L dwarfs. The position and kinematics of PSO J318.5-22 point to membership in the beta Pic moving group. Evolutionary models give a temperature of 1160(-40)(+30) K and a mass of 6.5(-1.0)(+1.3) M-Jup, making PSO J318.5-22 one of the lowest mass free-floating objects in the solar neighborhood. This object adds to the growing list of low-gravity field L dwarfs and is the first to be strongly deficient in methane relative to its estimated temperature. Comparing their spectra suggests that young L dwarfs with similar ages and temperatures can have different spectral signatures of youth. For the two objects with well constrained ages (PSO J318.5-22 and 2MASS J0355+11), we find their temperatures are approximate to 400 K cooler than field objects of similar spectral type but their luminosities are similar, i.e., these young L dwarfs are very red and unusually cool but not "underluminous." Altogether, PSO J318.5-22 is the first free-floating object with the colors, magnitudes, spectrum, luminosity, and mass that overlap the young dusty planets around HR 8799 and 2MASS J1207-39.	[Liu, Michael C.; Magnier, Eugene A.; Kotson, Michael C.; Aller, Kimberly M.; Burgett, W. S.; Chambers, K. C.; Hodapp, K. W.; Jedicke, R.; Kaiser, N.; Kudritzki, R. -P.; Morgan, J. S.; Tonry, J. L.; Wainscoat, R. J.] Univ Hawaii, Inst Astron, Honolulu, HI 96822 USA; [Deacon, Niall R.] Max Planck Inst Astron, D-69117 Heidelberg, Germany; [Allers, Katelyn N.] Bucknell Univ, Dept Phys & Astron, Lewisburg, PA 17837 USA; [Dupuy, Trent J.] Harvard Smithsonian Ctr Astrophys, Cambridge, MA 02138 USA; [Draper, P. W.; Price, P. A.] Princeton Univ, Dept Astrophys Sci, Princeton, NJ 08544 USA; [Metcalfe, N.] Univ Durham, Dept Phys, Durham DH1 3LE, England	Liu, MC (reprint author), Univ Hawaii, Inst Astron, 2680 Woodlawn Dr, Honolulu, HI 96822 USA.			Metcalfe, Nigel/0000-0001-9034-4402; Chambers, Kenneth /0000-0001-6965-7789	NSF [AST09-09222]; AFRL [FA9451-06-2-0338];  [AST-0709460]	The Pan-STARRS1 surveys have been made possible by the Institute for Astronomy, the University of Hawaii, the Pan-STARRS Project Office, the institutions of the Pan-STARRS1 Science Consortium (http://www.ps1sc.org), NSF, and NASA. We thank Brendan Bowler for assistance with the figures and Michael Cushing for providing a pre-release update of SpeXtool. Our research has employed the WISE and 2MASS data products, NASA's Astrophysical Data System, and the Spex Prism Spectral Libraries maintained by Adam Burgasser. This research was supported by NSF grants AST09-09222 (awarded to M.C.L.) and AST-0709460 (awarded to E.A.M.) as well as AFRL Cooperative Agreement FA9451-06-2-0338. Finally, the authors wish to recognize and acknowledge the very significant cultural role and reverence that the summit of Mauna Kea has always had within the indigenous Hawaiian community. We are most fortunate to have the opportunity to conduct observations from this mountain.		56	81	82	0	9	IOP PUBLISHING LTD	BRISTOL	TEMPLE CIRCUS, TEMPLE WAY, BRISTOL BS1 6BE, ENGLAND	2041-8205	2041-8213		ASTROPHYS J LETT	Astrophys. J. Lett.	NOV 10	2013	777	2							L20	10.1088/2041-8205/777/2/L20		7	Astronomy & Astrophysics	Astronomy & Astrophysics	242TY	WOS:000326266500002		No			2017-09-26	ASTROPHYSICAL JOURNAL LETTERS Volume: 777 Issue: 2 Article Number: L20 DOI: 10.1088/2041-8205/777/2/L20 Published: 2013		2041-8205 eISSN: 2041-8213	Germany; England; USA	Germany; England; United States	Germany; United Kingdom; United States	Allemagne; Royaume-Uni; Etats-Unis	DEU; GBR; USA
J	Rosen, L; Kochukhov, O; Wade, GA				Rosen, L.; Kochukhov, O.; Wade, G. A.			Strong variable linear polarization in the cool active star II Peg	MONTHLY NOTICES OF THE ROYAL ASTRONOMICAL SOCIETY			English	Article						polarization; stars: individual: II Peg; stars: individual: HR 1099; stars: individual: IM Peg; stars: individual: sigma Gem; stars: magnetic field	BINARY IM-PEGASI; STELLAR SURFACE-STRUCTURE; PROBE-B MISSION; AP-STARS; SIGMA-GEMINORUM; GUIDE STAR; LQ-HYDRAE; HR 1099; PARAMETERS; RECONSTRUCTION	Magnetic fields of cool active stars are currently studied polarimetrically using only circular polarization observations. Including linear polarization in the reconstruction of stellar magnetic fields allows more information about the magnetic field to be extracted and significantly improves the reliability of stellar magnetic field maps. The goal of this study is to initiate systematic observations of active stars in all four Stokes parameters and to identify cool stars for which linear polarization can be detected at a level sufficient for Zeeman-Doppler Imaging (ZDI). Four active RS CVn binaries, II Peg, HR 1099, IM Peg and sigma Gem, were observed with the ESPaDOnS spectropolarimeter at the Canada-France-Hawaii Telescope during a time period from 2012 February to 2013 January. The least-squares deconvolution procedure was applied to derive mean polarization profiles of all four Stokes parameters. Linear polarization was detected in all four stars in at least one observation. At the same time, II Peg showed an exceptionally strong and highly variable linear polarization signature throughout all observations. This establishes II Peg as the first promising target for ZDI in all four Stokes parameters and suggests the feasibility of such an analysis with existing equipment for at least a few of the most active cool stars.	[Rosen, L.; Kochukhov, O.] Uppsala Univ, Dept Phys & Astron, SE-75120 Uppsala, Sweden; [Wade, G. A.] Royal Mil Coll Canada, Dept Phys, Kingston, ON K7K 7B4, Canada	Rosen, L (reprint author), Uppsala Univ, Dept Phys & Astron, Box 516, SE-75120 Uppsala, Sweden.	lisa.rosen@physics.uu.se			Knut and Alice Wallenberg Foundation; Swedish Research Council; Natural Science and Engineering Research Council of Canada (NSERC)	OK is a Royal Swedish Academy of Sciences Research Fellow, supported by the grants from Knut and Alice Wallenberg Foundation and Swedish Research Council. GAW is supported by a Discovery Grant from the Natural Science and Engineering Research Council of Canada (NSERC).		30	7	8	0	0	OXFORD UNIV PRESS	OXFORD	GREAT CLARENDON ST, OXFORD OX2 6DP, ENGLAND	0035-8711	1365-2966		MON NOT R ASTRON SOC	Mon. Not. Roy. Astron. Soc.	NOV	2013	436	1					L10	L14		10.1093/mnrasl/slt102		5	Astronomy & Astrophysics	Astronomy & Astrophysics	245BY	WOS:000326435100003		No			2017-09-26	MONTHLY NOTICES OF THE ROYAL ASTRONOMICAL SOCIETY Volume: 436 Issue: 1 Pages: L10-L14 DOI: 10.1093/mnrasl/slt102 Published: 2013		0035-8711 eISSN: 1365-2966	Canada; Sweden	Canada; Sweden	Canada; Sweden	Canada; Suède	CAN; SWE
