PT	AU	BA	BE	GP	AF	BF	CA	TI	SO	SE	BS	LA	DT	CT	CY	CL	SP	HO	DE	ID	AB	C1	RP	EM	RI	OI	FU	FX	CR	NR	TC	Z9	U1	U2	PU	PI	PA	SN	EI	BN	J9	JI	PD	PY	VL	IS	PN	SU	SI	MA	BP	EP	AR	DI	D2	PG	WC	SC	GA	UT	PM	OA	HC	HP	DA	Source	Conference	Issn	PaysENG_I	PaysENG_C	PaysENG_R	PaysFRE_R	PaysISO3
J	Harnois-Deraps, J; van Waerbeke, L; Viola, M; Heymans, C				Harnois-Deraps, Joachim; van Waerbeke, Ludovic; Viola, Massimo; Heymans, Catherine			Baryons, neutrinos, feedback and weak gravitational lensing	MONTHLY NOTICES OF THE ROYAL ASTRONOMICAL SOCIETY			English	Article						gravitational lensing: weak; neutrinos; galaxies: formation; cosmological parameters; dark matter	MATTER POWER SPECTRUM; COSMIC SHEAR; GALAXY FORMATION; 2-POINT STATISTICS; COYOTE UNIVERSE; CFHTLENS; IMPACT; MODEL; COVARIANCES; CONSTRAINTS	The effect of baryonic feedback on the dark matter mass distribution is generally considered to be a nuisance to weak gravitational lensing. Measurements of cosmological parameters are affected as feedback alters the cosmic shear signal on angular scales smaller than a few arcminutes. Recent progress on the numerical modelling of baryon physics has shown that this effect could be so large that, rather than being a nuisance, the effect can be constrained with current weak lensing surveys, hence providing an alternative astrophysical insight on one of the most challenging questions of galaxy formation. In order to perform our analysis, we construct an analytic fitting formula that describes the effect of the baryons on the mass power spectrum. This fitting formula is based on three scenarios of the OverWhelmingly Large hydrodynamical simulations. It is specifically calibrated for z < 1.5, where it models the simulations to an accuracy that is better than 2 per cent for scales k < 10 h Mpc(-1) and better than 5 per cent for 10 < k < 100 h Mpc(-1). Equipped with this precise tool, this paper presents the first constraint on baryonic feedback models using gravitational lensing data, from the Canada France Hawaii Telescope Lensing Survey (CFHTLenS). In this analysis, we show that the effect of neutrino mass on the mass power spectrum is degenerate with the baryonic feedback at small angular scales and cannot be ignored. Assuming a cosmology precision fixed by WMAP9, we find that a universe with massless neutrinos is rejected by the CFHTLenS lensing data with 85-98 per cent confidence, depending on the baryon feedback model. Some combinations of feedback and non-zero neutrino masses are also disfavoured by the data, although it is not yet possible to isolate a unique neutrino mass and feedback model. Our study shows that ongoing weak gravitational lensing surveys (KiDS, HSC and DES) will offer a unique opportunity to probe the physics of baryons at galactic scales, in addition to the expected constraints on the total neutrino mass.	[Harnois-Deraps, Joachim; van Waerbeke, Ludovic] Univ British Columbia, Dept Phys & Astron, Vancouver, BC V6T 1Z1, Canada; [Harnois-Deraps, Joachim] Univ Toronto, Canadian Inst Theoret Astrophys, Toronto, ON M5S 3H8, Canada; [Viola, Massimo] Leiden Univ, Leiden Observ, NL-2300 RA Leiden, Netherlands; [Heymans, Catherine] Univ Edinburgh, Royal Observ, Inst Astron, Scottish Univ Phys Alliance, Edinburgh EH9 3HJ, Midlothian, Scotland	Harnois-Deraps, J (reprint author), Univ British Columbia, Dept Phys & Astron, Vancouver, BC V6T 1Z1, Canada.	jharno@phas.ubc.ca			Canada Foundation for Innovation under Compute Canada; Government of Ontario; Ontario Research Fund - Research Excellence; University of Toronto; CITA National Fellowship; NSERC; Canadian Institute for Advanced Research CIfAR; Netherlands Organization for Scientific Research (NWO) [614.001.103]; European Research Council [279396, 240185]; Canadian Space Agency	We are deeply grateful to Lance Miller for his essential work on the good/bad field selection code and shear calibrations pipelines, and to all the CFHTLenS team for having made public their high-quality shear data. We also thank Fergus Simpson and Martin Kilbinger for providing their comments on the draft. Computations for the N-body simulations were performed on the GPC supercomputer at the SciNet HPC Consortium. SciNet is funded by: the Canada Foundation for Innovation under the auspices of Compute Canada; the Government of Ontario; Ontario Research Fund - Research Excellence; and the University of Toronto. JHD is supported by a CITA National Fellowship and NSERC, and LvW is funded by the NSERC and Canadian Institute for Advanced Research CIfAR. MV is funded by grant 614.001.103 from the Netherlands Organization for Scientific Research (NWO). MV and CH acknowledge support from the European Research Council under FP7 grant number 279396 (MV) and 240185 (CH). This work is based on observations obtained with MegaPrime/MegaCam, a joint project of CFHT and CEA/IRFU, at the Canada-France-Hawaii Telescope (CFHT) which is operated by the National Research Council (NRC) of Canada, the Institut National des Sciences de l'Univers of the Centre National de la Recherche Scientifique (CNRS) of France, and the University of Hawaii. This research used the facilities of the Canadian Astronomy Data Centre operated by the National Research Council of Canada with the support of the Canadian Space Agency. CFHTLenS data processing was made possible thanks to significant computing support from the NSERC Research Tools and Instruments grant program.		50	25	25	0	1	OXFORD UNIV PRESS	OXFORD	GREAT CLARENDON ST, OXFORD OX2 6DP, ENGLAND	0035-8711	1365-2966		MON NOT R ASTRON SOC	Mon. Not. Roy. Astron. Soc.	JUN 21	2015	450	2					1212	1223		10.1093/mnras/stv646		12	Astronomy & Astrophysics	Astronomy & Astrophysics	CK6LB	WOS:000356338500004		No			2017-09-26	MONTHLY NOTICES OF THE ROYAL ASTRONOMICAL SOCIETY Volume: 450 Issue: 2 Pages: 1212-1223 DOI: 10.1093/mnras/stv646 Published: 2015		0035-8711 eISSN: 1365-2966	Canada; Netherlands; Scotland	Canada; Netherlands; Scotland	Canada; Netherlands; United Kingdom	Canada; Pays-Bas; Royaume-Uni	CAN; NLD; GBR
J	Ford, J; Van Waerbeke, L; Milkeraitis, M; Laigle, C; Hildebrandt, H; Erben, T; Heymans, C; Hoekstra, H; Kitching, T; Mellier, Y; Miller, L; Choi, A; Coupon, J; Fu, LP; Hudson, MJ; Kuijken, K; Robertson, N; Rowe, B; Schrabback, T; Velander, M				Ford, Jes; Van Waerbeke, Ludovic; Milkeraitis, Martha; Laigle, Clotilde; Hildebrandt, Hendrik; Erben, Thomas; Heymans, Catherine; Hoekstra, Henk; Kitching, Thomas; Mellier, Yannick; Miller, Lance; Choi, Ami; Coupon, Jean; Fu, Liping; Hudson, Michael J.; Kuijken, Konrad; Robertson, Naomi; Rowe, Barnaby; Schrabback, Tim; Velander, Malin			CFHTLenS: a weak lensing shear analysis of the 3D-Matched-Filter galaxy clusters	MONTHLY NOTICES OF THE ROYAL ASTRONOMICAL SOCIETY			English	Article						gravitational lensing: weak; galaxies: clusters: general; galaxies: photometry; dark matter	DARK-MATTER HALOES; DIGITAL SKY SURVEY; LARGE-SCALE BIAS; MASS-RICHNESS RELATION; LYMAN-BREAK GALAXIES; PHOTOMETRIC REDSHIFTS; MAXBCG CLUSTERS; MAGNIFICATION; PROFILES; ALGORITHM	We present the cluster mass-richness scaling relation calibrated by a weak lensing analysis of greater than or similar to 18 000 galaxy cluster candidates in the Canada-France-Hawaii Telescope Lensing Survey (CFHTLenS). Detected using the 3D-Matched-Filter (MF) cluster-finder of Milkeraitis et al., these cluster candidates span a wide range of masses, from the small group scale up to similar to 1015M(circle dot), and redshifts 0.2 less than or similar to z less than or similar to 0.9. The total significance of the stacked shear measurement amounts to 54 sigma. We compare cluster masses determined using weak lensing shear and magnification, finding the measurements in individual richness bins to yield 1 sigma compatibility, but with magnification estimates biased low. This first direct mass comparison yields important insights for improving the systematics handling of future lensing magnification work. In addition, we confirm analyses that suggest cluster miscentring has an important effect on the observed 3D-MF halo profiles, and we quantify this by fitting for projected cluster centroid offsets, which are typically similar to 0.4 arcmin. We bin the cluster candidates as a function of redshift, finding similar cluster masses and richness across the full range up to z similar to 0.9. We measure the 3D-MF mass-richness scaling relation M-200 = M-0(N-200/20)(beta). We find a normalization M-0 similar to (2.7(-0.4)(+0.5)) x 10(13)M(circle dot), and a logarithmic slope of beta similar to 1.4 +/- 0.1, both of which are in 1 sigma agreement with results from the magnification analysis. We find no evidence for a redshift dependence of the normalization. The CFHTLenS 3D-MF cluster catalogue is now available at cfhtlens. org.	[Ford, Jes; Van Waerbeke, Ludovic; Milkeraitis, Martha; Laigle, Clotilde; Hildebrandt, Hendrik] Univ British Columbia, Dept Phys & Astron, Vancouver, BC V6T 1Z1, Canada; [Laigle, Clotilde; Mellier, Yannick] Univ Paris 06, CNRS, Inst Astrophys Paris, UMR7095, F-75014 Paris, France; [Laigle, Clotilde] Ecole Polytech, F-91128 Palaiseau, France; [Hildebrandt, Hendrik; Erben, Thomas; Schrabback, Tim] Argelander Inst Astron, D-53121 Bonn, Germany; [Heymans, Catherine; Choi, Ami; Robertson, Naomi] Univ Edinburgh, Inst Astron, Scottish Univ Phys Alliance, Edinburgh EH9 3HJ, Midlothian, Scotland; [Hoekstra, Henk; Kuijken, Konrad; Schrabback, Tim; Velander, Malin] Leiden Univ, Leiden Observ, NL-2333 CA Leiden, Netherlands; [Kitching, Thomas] Univ Coll London, Mullard Space Sci Lab, Dorking RH5 6NT, Surrey, England; [Mellier, Yannick] CEA, Irfu, SAp Saclay, Lab AIM, F-91191 Gif Sur Yvette, France; [Miller, Lance; Velander, Malin] Univ Oxford, Dept Phys, Oxford OX1 3RH, England; [Coupon, Jean] Univ Geneva, Astron Observ, CH-1290 Versoix, Switzerland; [Coupon, Jean] Acad Sinica, Inst Astron & Astrophys, Taipei 10617, Taiwan; [Fu, Liping] Shanghai Normal Univ, Shanghai Key Lab Astrophys, Shanghai 200234, Peoples R China; [Hudson, Michael J.] Univ Waterloo, Dept Phys & Astron, Waterloo, ON N2L 3G1, Canada; [Hudson, Michael J.] Perimeter Inst Theoret Phys, Waterloo, ON N2L 2Y5, Canada; [Rowe, Barnaby] UCL, Dept Phys & Astron, London WC1E 6BT, England; [Rowe, Barnaby] CALTECH, Jet Prop Lab, Pasadena, CA 91109 USA; [Schrabback, Tim] Stanford Univ, Kavli Inst Particle Astrophys & Cosmol, Stanford, CA 94305 USA	Ford, J (reprint author), Univ British Columbia, Dept Phys & Astron, 6224 Agr Rd, Vancouver, BC V6T 1Z1, Canada.	jesford@phas.ubc.ca	Hudson, Michael/H-3238-2012; Fu, Liping/B-3051-2012	Hudson, Michael/0000-0002-1437-3786; Ford, Jes/0000-0002-2946-3776; Rowe, Barnaby/0000-0002-7042-9174; Kuijken, Konrad/0000-0002-3827-0175	UBC Four-Year-Fellowship; NSERC; CIfAR; DFG Emmy Noether grant [Hi 1495/2-1]; Deutsche Forschungsgemeinschaft [ER 327/3-1]; Transregional Collaborative Research Centre TR 33 - 'The Dark Universe'; European Research Council under the EC FP7 [240185]; NSFC [11103012, 11333001]; SMEC [12ZZ134]; STCSM [11290706600]; Pujiang Programme [12PJ1406700]; Shanghai Research grant [13JC1404400]	The authors would like to thank Jasper Wall for helpful discussions on statistics, and the referee for providing helpful feedback and suggestions that greatly improved this work. JF is supported by a UBC Four-Year-Fellowship and NSERC. LVW is supported by NSERC and CIfAR. HHi is supported by the DFG Emmy Noether grant Hi 1495/2-1. TE is supported by the Deutsche Forschungsgemeinschaft through project ER 327/3-1 and the Transregional Collaborative Research Centre TR 33 - 'The Dark Universe'. CH, AC, and NR acknowledge funding from the European Research Council under the EC FP7 grant number 240185. LF acknowledges support from NSFC grants 11103012 & 11333001, Innovation Programme 12ZZ134 of SMEC, STCSM grant 11290706600, Pujiang Programme 12PJ1406700 and Shanghai Research grant 13JC1404400. MH is supported by NSERC.; This work is partly based on observations obtained with MegaPrime/MegaCam, a joint project of CFHT and CEA/IRFU, at the CFHT which is operated by the National Research Council (NRC) of Canada, the Institut National des Sciences de lUnivers of the Centre National de la Recherche Scientifique (CNRS) of France, and the University of Hawaii. This research used the facilities of the Canadian Astronomy Data Centre operated by the NRC of Canada with the support of the Canadian Space Agency. CFHTLenS data processing was made possible thanks to significant computing support from the NSERC Research Tools and Instruments grant programme.		68	12	12	1	3	OXFORD UNIV PRESS	OXFORD	GREAT CLARENDON ST, OXFORD OX2 6DP, ENGLAND	0035-8711	1365-2966		MON NOT R ASTRON SOC	Mon. Not. Roy. Astron. Soc.	FEB 21	2015	447	2					1304	1318		10.1093/mnras/stu2545		15	Astronomy & Astrophysics	Astronomy & Astrophysics	CC3TM	WOS:000350272900023		No			2017-09-26	MONTHLY NOTICES OF THE ROYAL ASTRONOMICAL SOCIETY Volume: 447 Issue: 2 Pages: 1304-1318 DOI: 10.1093/mnras/stu2545 Published: 2015		0035-8711 eISSN: 1365-2966	Canada; France; Germany; Netherlands; Peoples R China; Switzerland; Taiwan; England; Scotland; USA	Canada; France; Germany; Netherlands; People's Republic of China; Switzerland; Taiwan; England; Scotland; United States	Canada; France; Germany; Netherlands; People's Republic of China; Switzerland; Taiwan; United Kingdom; United States	Canada; France; Allemagne; Pays-Bas; Chine; Suisse; Taïwan, Province de Chine; Royaume-Uni; Etats-Unis	CAN; FRA; DEU; NLD; CHN; CHE; TWN; GBR; USA
J	Duc, PA; Cuillandre, JC; Karabal, E; Cappellari, M; Alatalo, K; Blitz, L; Bournaud, F; Bureau, M; Crocker, AF; Davies, RL; Davis, TA; de Zeeuw, PT; Emsellem, E; Khochfar, S; Krajnovic, D; Kuntschner, H; McDermid, RM; Michel-Dansac, L; Morganti, R; Naab, T; Oosterloo, T; Paudel, S; Sarzi, M; Scott, N; Serra, P; Weijmans, AM; Young, LM				Duc, Pierre-Alain; Cuillandre, Jean-Charles; Karabal, Emin; Cappellari, Michele; Alatalo, Katherine; Blitz, Leo; Bournaud, Frederic; Bureau, Martin; Crocker, Alison F.; Davies, Roger L.; Davis, Timothy A.; de Zeeuw, P. T.; Emsellem, Eric; Khochfar, Sadegh; Krajnovic, Davor; Kuntschner, Harald; McDermid, Richard M.; Michel-Dansac, Leo; Morganti, Raffaella; Naab, Thorsten; Oosterloo, Tom; Paudel, Sanjaya; Sarzi, Marc; Scott, Nicholas; Serra, Paolo; Weijmans, Anne-Marie; Young, Lisa M.			The ATLAS(3D) project - XXIX. The new look of early-type galaxies and surrounding fields disclosed by extremely deep optical images	MONTHLY NOTICES OF THE ROYAL ASTRONOMICAL SOCIETY			English	Article						techniques: photometric; galaxies: elliptical and lenticular, cD; galaxies: interactions; galaxies: photometry; galaxies: stellar content	DIGITAL-SKY-SURVEY; GENERATION VIRGO CLUSTER; FRANCE-HAWAII-TELESCOPE; H-I OBSERVATIONS; TO-LIGHT RATIO; ELLIPTIC GALAXIES; STELLAR POPULATIONS; DWARF GALAXIES; STAR-FORMATION; DISK GALAXIES	Galactic archaeology based on star counts is instrumental to reconstruct the past mass assembly of Local Group galaxies. The development of new observing techniques and data reduction, coupled with the use of sensitive large field of view cameras, now allows us to pursue this technique in more distant galaxies exploiting their diffuse low surface brightness (LSB) light. As part of the ATLAS(3D) project, we have obtained with the MegaCam camera at the Canada-France-Hawaii Telescope extremely deep, multiband images of nearby early-type galaxies (ETGs). We present here a catalogue of 92 galaxies from the ATLAS(3D) sample, which are located in low-to medium-density environments. The observing strategy and data reduction pipeline, which achieve a gain of several magnitudes in the limiting surface brightness with respect to classical imaging surveys, are presented. The size and depth of the survey are compared to other recent deep imaging projects. The paper highlights the capability of LSB-optimized surveys at detecting new prominent structures that change the apparent morphology of galaxies. The intrinsic limitations of deep imaging observations are also discussed, among those, the contamination of the stellar haloes of galaxies by extended ghost reflections, and the cirrus emission from Galactic dust. The detection and systematic census of fine structures that trace the present and past mass assembly of ETGs are one of the prime goals of the project. We provide specific examples of each type of observed structures - tidal tails, stellar streams and shells - and explain how they were identified and classified. We give an overview of the initial results. The detailed statistical analysis will be presented in future papers.	[Duc, Pierre-Alain; Cuillandre, Jean-Charles; Karabal, Emin; Bournaud, Frederic; Paudel, Sanjaya] CEA Irfu SAp CNRS Univ Paris Diderot, Lab AIM Paris Saclay, F-91191 Gif Sur Yvette, France; [Cuillandre, Jean-Charles] PSL Res Univ, Observ Paris, F-75014 Paris, France; [Karabal, Emin; Davis, Timothy A.; de Zeeuw, P. T.; Emsellem, Eric; Kuntschner, Harald] European So Observ, D-85748 Garching, Germany; [Cappellari, Michele; Bureau, Martin; Davies, Roger L.] Univ Oxford, Dept Phys, Subdept Astrophys, Oxford OX1 3RH, England; [Alatalo, Katherine] CALTECH, Ctr Infrared Proc & Anal, Pasadena, CA 91125 USA; [Blitz, Leo] Univ Calif Berkeley, Dept Astron, Berkeley, CA 94720 USA; [Crocker, Alison F.] Univ Toledo, Ritter Astrophys Observ, Toledo, OH 43606 USA; [de Zeeuw, P. T.] Leiden Univ, Sterrewacht Leiden, NL-2300 RA Leiden, Netherlands; [Emsellem, Eric; Michel-Dansac, Leo] Univ Lyon 1, Observ Lyon, Ctr Rech Astrophys Lyon, F-69230 St Genis Laval, France; [Emsellem, Eric; Michel-Dansac, Leo] Ecole Normale Super Lyon, F-69230 St Genis Laval, France; [Khochfar, Sadegh] Univ Edinburgh, Royal Observ, Inst Astron, Edinburgh EH9 3HJ, Midlothian, Scotland; [Krajnovic, Davor] Leibniz Inst Astrophys Potsdam AIP, D-14482 Potsdam, Germany; [McDermid, Richard M.] Macquarie Univ, Dept Phys & Astron, Sydney, NSW 2109, Australia; [McDermid, Richard M.] Australian Astron Observ, Australian Gemini Off, Sydney, NSW 1670, Australia; [Morganti, Raffaella; Oosterloo, Tom; Serra, Paolo] Netherlands Inst Radio Astron ASTRON, NL-7990 AA Dwingeloo, Netherlands; [Morganti, Raffaella; Oosterloo, Tom] Univ Groningen, Kapteyn Astron Inst, NL-9700 AV Groningen, Netherlands; [Naab, Thorsten] Max Planck Inst Astrophys, D-85741 Garching, Germany; [Sarzi, Marc] Univ Hertfordshire, Ctr Astrophys Res, Hatfield AL1 9AB, Herts, England; [Scott, Nicholas] Univ Sydney, Sch Phys, SIfA, Sydney, NSW 2006, Australia; [Serra, Paolo] CSIRO Astron & Space Sci, Australia Telescope Natl Facil, Epping, NSW 1710, Australia; [Weijmans, Anne-Marie] Univ St Andrews, Sch Phys & Astron, St Andrews KY16 9SS, Fife, Scotland; [Young, Lisa M.] New Mexico Inst Min & Technol, Dept Phys, Socorro, NM 87801 USA; [Young, Lisa M.] Acad Sinica, Inst Astron & Astrophys, Taipei 10617, Taiwan	Duc, PA (reprint author), CEA Irfu SAp CNRS Univ Paris Diderot, Lab AIM Paris Saclay, F-91191 Gif Sur Yvette, France.	paduc@cea.fr		Davis, Timothy/0000-0003-4932-9379; Scott, Nicholas/0000-0001-8495-8547	Agence Nationale de la Recherche [ANR10-BLANC-0506-01]; Lyon Institute of Origins [ANR-10-LABX-66]; Royal Society University Research Fellowship; UK Research Councils [PP/E001114/1, ST/H002456/1, PPA/V/S/2002/00553, PP/E001564/1, ST/H504862/1]; Christ Church, Oxford; Royal Society [502011.K502/jd, JP0869822]; DFG Cluster of Excellence 'Origin and Structure of the Universe'; STFC Advanced Fellowship [ST/F009186/1]; NSF [AST-1109803]; ESO fellowship; European Community's Seventh Framework Programme (/FP7) [229517]; ESO	The paper is based on observations obtained with MegaPrime/MegaCam, a joint project of CFHT and CEA/DAPNIA, at the Canada-France-Hawaii Telescope (CFHT), which is operated by the National Research Council (NRC) of Canada, the Institute National des Sciences de l'Univers of the Centre National de la Recherche Scientifique of France and the University of Hawaii. All observations were made as part of the service mode offered by the CFHT. We are grateful to the queue team for their dedication and for the anonymous referee. The project greatly benefited from the experience of the NGVS team members, in particular Laura Ferrarese, Patrick Cote, Chris Mihos, and discussions with Etienne Ferriere, Rodrigo Ibata and David Valls-Gabaud who contributed very much to the advance of LSB science. We are grateful to Velimir Popov and Emil Ivanov who run the robotic amateur Irida observatory in Bulgaria, obtained and reduced the image of NGC 474 shown in Fig. 7. We warmly thank Herve Dole who extracted the Planck images we used to estimate cirrus contamination. This research has made use of the NASA/IPAC Extragalactic Database (NED) which is operated by the Jet Propulsion Laboratory, California Institute of Technology, under contract with the National Aeronautics and Space Administration. P-AD acknowledges support from Agence Nationale de la Recherche (ANR10-BLANC-0506-01). LM-D acknowledges support from the Lyon Institute of Origins under grant ANR-10-LABX-66. MC acknowledges support from a Royal Society University Research Fellowship. This work was supported by the rolling grants PP/E001114/1 and ST/H002456/1 and visitors grants PPA/V/S/2002/00553, PP/E001564/1 and ST/H504862/1 from the UK Research Councils. RLD acknowledges travel and computer grants from Christ Church, Oxford, and support from the Royal Society in the form of a Wolfson Merit Award 502011.K502/jd. SK acknowledges support from the Royal Society Joint Projects Grant JP0869822. TN acknowledges support from the DFG Cluster of Excellence 'Origin and Structure of the Universe'. MS acknowledges support from a STFC Advanced Fellowship ST/F009186/1. LMY acknowledges support from NSF grant AST-1109803. TAD acknowledges the support provided by an ESO fellowship. The research leading to these results has received funding from the European Community's Seventh Framework Programme (/FP7/2007-2013/) under grant agreement No 229517. The authors acknowledge financial support from ESO.		95	63	63	0	3	OXFORD UNIV PRESS	OXFORD	GREAT CLARENDON ST, OXFORD OX2 6DP, ENGLAND	0035-8711	1365-2966		MON NOT R ASTRON SOC	Mon. Not. Roy. Astron. Soc.	JAN	2015	446	1					120	143		10.1093/mnras/stu2019		24	Astronomy & Astrophysics	Astronomy & Astrophysics	AY3ZP	WOS:000347518300009		No	Y	N	2017-09-26	MONTHLY NOTICES OF THE ROYAL ASTRONOMICAL SOCIETY Volume: 446 Issue: 1 Pages: 120-143 DOI: 10.1093/mnras/stu2019 Published: 2015		0035-8711 eISSN: 1365-2966	Australia; France; Germany; Netherlands; Taiwan; England; Scotland; USA	Australia; France; Germany; Netherlands; Taiwan; England; Scotland; United States	Australia; France; Germany; Netherlands; Taiwan; United Kingdom; United States	Australie; France; Allemagne; Pays-Bas; Taïwan, Province de Chine; Royaume-Uni; Etats-Unis	AUS; FRA; DEU; NLD; TWN; GBR; USA
