PT	AU	BA	BE	GP	AF	BF	CA	TI	SO	SE	BS	LA	DT	CT	CY	CL	SP	HO	DE	ID	AB	C1	RP	EM	RI	OI	FU	FX	CR	NR	TC	Z9	U1	U2	PU	PI	PA	SN	EI	BN	J9	JI	PD	PY	VL	IS	PN	SU	SI	MA	BP	EP	AR	DI	D2	PG	WC	SC	GA	UT	PM	OA	HC	HP	DA	Source	Conference	Issn	PaysENG_I	PaysENG_C	PaysENG_R	PaysFRE_R	PaysISO3
J	Baran, N; Smolcic, V; Milakovic, D; Novak, M; Delhaize, J; Gastaldello, F; Ramos-Ceja, ME; Pacaud, F; Bourke, S; Carilli, CL; Ettori, S; Hallinan, G; Horellou, C; Koulouridis, E; Chiappetti, L; Miettinen, O; Melnyk, O; Mooley, K; Pierre, M; Pompei, E; Schinnerer, E				Baran, N.; Smolcic, V.; Milakovic, D.; Novak, M.; Delhaize, J.; Gastaldello, F.; Ramos-Ceja, M. E.; Pacaud, F.; Bourke, S.; Carilli, C. L.; Ettori, S.; Hallinan, G.; Horellou, C.; Koulouridis, E.; Chiappetti, L.; Miettinen, O.; Melnyk, O.; Mooley, K.; Pierre, M.; Pompei, E.; Schinnerer, E.			The XXL Survey IX. Optical overdensity and radio continuum analysis of a supercluster at z=0.43	ASTRONOMY & ASTROPHYSICS			English	Article						catalogs; galaxies: clusters: general; galaxies: groups: general; radio continuum: galaxies	EXTRAGALACTIC LEGACY SURVEY; TELESCOPE LENSING SURVEY; ACTIVE GALACTIC NUCLEI; VLA-COSMOS SURVEY; PHOTOMETRIC REDSHIFTS; SHAPLEY CONCENTRATION; IMAGING DATA; CLUSTER COMPLEX; STAR-FORMATION; WIDE FIELDS	We present observations with the Karl G. Jansky Very Large Array (VLA) at 3 GHz (10 cm) toward a sub-field of the XXL-North 25 deg(2) field targeting the first supercluster discovered in the XXL Survey. The structure has been found at a spectroscopic redshift of 0.43 and extending over 0.degrees 35x0.degrees 1 on the sky. The aim of this paper is twofold. First, we present the 3 GHz VLA radio continuum observations, the final radio mosaic and radio source catalogue, and, second, we perform a detailed analysis of the supercluster in the optical and radio regimes using photometric redshifts from the CFHTLS survey and our new VLA-XXL data. Our final 3 GHz radio mosaic has a resolution of 3 ''.2 x 1 ''.9, and encompasses an area of 41'x41' with rms noise level lower than similar to 20 mu Jy beam(-1). The noise in the central 15'x15' region is approximate to 11 mu Jy beam(-1). From the mosaic we extract a catalogue of 155 radio sources with signal-to-noise ratio (S/N) >= 6, eight of which are large, multicomponent sources, and 123 (79%) of which can be associated with optical sources in the CFHTLS W1 catalogue. Applying Voronoi tessellation analysis (VTA) in the area around the X-ray identified supercluster using photometric redshifts from the CFHTLS survey we identify a total of seventeen overdensities at z(phot) = 0.35-0.50, 7 of which are associated with clusters detected in the XMM-Newton XXL data. We find a mean photometric redshift of 0.43 for our overdensities, consistent with the spectroscopic redshifts of the brightest cluster galaxies of seven X-ray detected clusters. The full VTA-identified structure extends over similar to 0.degrees 6x0.degrees 2on the sky, which corresponds to a physical size of similar to 12x4 Mpc(2) at z = 0.43. No large radio galaxies are present within the overdensities, and we associate eight (S/N > 7) radio sources with potential group/cluster member galaxies. The spatial distribution of the red and blue VTA-identified potential group member galaxies, selected by their observed g -r colours, suggests that the clusters are not virialised yet, but are dynamically young, as expected for hierarchical structure growth in a Lambda CDM universe. Further spectroscopic data are required to analyse the dynamical state of the groups.	[Baran, N.; Smolcic, V.; Milakovic, D.; Novak, M.; Delhaize, J.; Miettinen, O.; Melnyk, O.] Univ Zagreb, Dept Phys, Bijenieka Cesta 32, Zagreb 10000, Croatia; [Gastaldello, F.; Chiappetti, L.] INAF IASF Milano, Via Bassini 15, I-20133 Milan, Italy; [Ramos-Ceja, M. E.; Pacaud, F.] Argelander Inst Astron, Hugel 71, D-53121 Bonn, Germany; [Bourke, S.; Hallinan, G.; Mooley, K.] CALTECH, Dept Astron, 1200 East Calif Blvd, Pasadena, CA 91125 USA; [Carilli, C. L.] Natl Radio Astron Observ, POB O, Socorro, NM 87801 USA; [Ettori, S.] INAF, Osservatorio Astron Bologna, Via Ranzani 1, I-40127 Bologna, Italy; [Horellou, C.] Chalmers, Dept Earth & Space Sci, Onsala Space Observ, S-43992 Onsala, Sweden; [Koulouridis, E.; Pierre, M.] CEA Saclay, DSM IRFU SAp, Serv Astrophys AIM, F-91191 Gif Sur Yvette, France; [Pompei, E.] European Southern Observ, Alonso Cordova 3107,19001 Casilla, Santiago 19, Chile; [Schinnerer, E.] Max Planck Inst Astron, Konigstuhl 17, D-69117 Heidelberg, Germany; [Melnyk, O.] Taras Shevchenko Natl Univ Kyiv, Astron Observ, 3 Observatorna St, UA-04053 Kiev, Ukraine	Baran, N (reprint author), Univ Zagreb, Dept Phys, Bijenieka Cesta 32, Zagreb 10000, Croatia.	nbaran@phy.hr	Koulouridis, Elias/C-4731-2014	Ramos Ceja, Miriam Elizabeth/0000-0002-9117-3251; Gastaldello, Fabio/0000-0002-9112-0184	Centre National d'Etudes Spatiales (CNES); BMBF DLR grant [50 OR 1117]; DfG Transregio Programme [TR33]; European Union [333654, 337595, 291823, 83]; International Programme for Scientific Cooperation CNRS-INAF PICS; ESA Member States; NASA; Canadian Space Agency	XXL is an international project based around an XMM Very Large Programme surveying two 25 deg<SUP>2</SUP> extragalactic fields at a depth of similar to 5 x 10<SUP>-15</SUP> erg cm<SUP>-2</SUP> s<SUP>-1</SUP> in the [0.5-2] keV band for point-like sources. The XXL website is http://irfu.cea.fr/xxl. Multiband information and spectroscopic follow-up of the X-ray sources are obtained through a number of survey programmes, summarised at http://xxlmultiwave.pbworks.com/. Funding Saclay group: long-term support by the Centre National d'Etudes Spatiales (CNES). F.P.: support from BMBF DLR grant 50 OR 1117 and support from the DfG Transregio Programme TR33. Zgal group: European Union's Seventh Framework program under grant agreement 333654 (CIG, "AGN feedback"; N.B., V.S.) and grant agreement 337595 (ERC Starting Grant, "CoSMass"; V.S., J.D., O.Mi., M.N.). Italian and French groups: support from the International Programme for Scientific Cooperation CNRS-INAF PICS 2012. O.Me. acknowledges for the financial support provided by the European Union Seventh Framework Programme (FP7 2007-2013), grant agreement No. 291823 Marie Curie FP7-PEOPLE-2011-COFUND (The new International Fellowship Mobility Programme for Experienced Researchers in Croatia - NEWFELPRO, project "AGN environs in XXL", Grant Agreement #83). We thank the referee for a very useful report. Authors of this paper acknowledge Olivier Ilbert's valuable input. This work is based on observations obtained with XMM-Newton, an ESA science mission with instruments and contributions directly funded by ESA Member States and NASA. This work is also based on observations obtained with MegaPrime/MegaCam, a joint project of CFHT and CEA/DAPNIA, at the Canada-France-Hawaii Telescope (CFHT) which is operated by the National Research Council (NRC) of Canada, the Institut National des Sciences de l'Univers of the Centre National de la Recherche Scientifique (CNRS) of France, and the University of Hawaii. This research used the facilities of the Canadian Astronomy Data Centre operated by the National Research Council of Canada with the support of the Canadian Space Agency. CFHTLenS data processing was made possible thanks to significant computing support from the NSERC Research Tools and Instruments grant program.		54	2	2	0	4	EDP SCIENCES S A	LES ULIS CEDEX A	17, AVE DU HOGGAR, PA COURTABOEUF, BP 112, F-91944 LES ULIS CEDEX A, FRANCE	1432-0746			ASTRON ASTROPHYS	Astron. Astrophys.	AUG	2016	592								A8	10.1051/0004-6361/201526952		15	Astronomy & Astrophysics	Astronomy & Astrophysics	DX9NO	WOS:000384722600022	29054590	No			2017-09-26	ASTRONOMY & ASTROPHYSICS Volume: 592 Article Number: A8 DOI: 10.1051/0004-6361/201526952 Published: 2016		1432-0746	Chile; Croatia; France; Germany; Italy; Sweden; Ukraine; USA	Chile; Chile; Chile; Chile; Chile; Chile; Chile; Chile; Chile; Chile; Chile; Croatia; France; Germany; Italy; Sweden; Ukraine; United States	Chile; Croatia; France; Germany; Italy; Sweden; Ukraine; United States	Chili; Croatie; France; Allemagne; Italie; Suède; Ukraine; Etats-Unis	CHL; HRV; FRA; DEU; ITA; SWE; UKR; USA
J	Laigle, C; McCracken, HJ; Ilbert, O; Hsieh, BC; Davidzon, I; Capak, P; Hasinger, G; Silverman, JD; Pichon, C; Coupon, J; Aussel, H; Le Borgne, D; Caputi, K; Cassata, P; Chang, YY; Civano, F; Dunlop, J; Fynbo, J; Kartaltepe, JS; Koekemoer, A; Le Fevre, O; Le Floc'h, E; Leauthaud, A; Lilly, S; Lin, L; Marchesi, S; Milvang-Jensen, B; Salvato, M; Sanders, DB; Scoville, N; Smolcic, V; Stockmann, M; Taniguchi, Y; Tasca, L; Toft, S; Vaccari, M; Zabl, J				Laigle, C.; McCracken, H. J.; Ilbert, O.; Hsieh, B. C.; Davidzon, I.; Capak, P.; Hasinger, G.; Silverman, J. D.; Pichon, C.; Coupon, J.; Aussel, H.; Le Borgne, D.; Caputi, K.; Cassata, P.; Chang, Y. -Y.; Civano, F.; Dunlop, J.; Fynbo, J.; Kartaltepe, J. S.; Koekemoer, A.; Le Fevre, O.; Le Floc'h, E.; Leauthaud, A.; Lilly, S.; Lin, L.; Marchesi, S.; Milvang-Jensen, B.; Salvato, M.; Sanders, D. B.; Scoville, N.; Smolcic, V.; Stockmann, M.; Taniguchi, Y.; Tasca, L.; Toft, S.; Vaccari, Mattia; Zabl, J.			THE COSMOS2015 CATALOG: EXPLORING THE 1 < z < 6 UNIVERSE WITH HALF A MILLION GALAXIES	ASTROPHYSICAL JOURNAL SUPPLEMENT SERIES			English	Article						catalogs; galaxies: evolution; galaxies: high-redshift; galaxies: photometry; methods: observational; techniques: photometric	STAR-FORMING GALAXIES; SIMILAR-TO 2; STELLAR MASS FUNCTION; WIDE-FIELD SURVEY; VLT DEEP SURVEY; SPECTRAL ENERGY-DISTRIBUTIONS; EVOLUTION SURVEY COSMOS; ACTIVE GALACTIC NUCLEI; UV-SELECTED GALAXIES; NEAR-INFRARED SURVEY	We present the COSMOS2015(24) catalog, which contains precise photometric redshifts and stellar masses for more than half a million objects over the 2deg(2) COSMOS field. Including new YJHK(s) images from the UltraVISTA-DR2 survey, Y-band images from Subaru/Hyper-Suprime-Cam, and infrared data from the Spitzer Large Area Survey with the Hyper-Suprime-Cam Spitzer legacy program, this near-infrared-selected catalog is highly optimized for the study of galaxy evolution and environments in the early universe. To maximize catalog completeness for bluer objects and at higher redshifts, objects have been detected on a chi(2) sum of the YJHK(s) and z(++) images. The catalog contains similar to 6 x 10(5) objects in the 1.5 deg(2) UltraVISTA-DR2 region and similar to 1.5 x 10(5) objects are detected in the "ultra-deep stripes" (0.62 deg(2)) at K-s <= 24.7 (3 sigma, 3 '', AB magnitude). Through a comparison with the zCOSMOS-bright spectroscopic redshifts, we measure a photometric redshift precision of sigma(Delta z(1) (+ zs)) = 0.007 and a catastrophic failure fraction of eta = 0.5%. At 3 < z < 6, using the unique database of spectroscopic redshifts in COSMOS, we find sigma(Delta z(1) (+ zs)) = 0.021 and eta = 13.2%. The deepest regions reach a 90% completeness limit of 10(10)M(circle dot) to z = 4. Detailed comparisons of the color distributions, number counts, and clustering show excellent agreement with the literature in the same mass ranges. COSMOS2015 represents a unique, publicly available, valuable resource with which to investigate the evolution of galaxies within their environment back to the earliest stages of the history of the universe. The COSMOS2015 catalog is distributed via anonymous ftp and through the usual astronomical archive systems (CDS, ESO Phase 3, IRSA).	[Laigle, C.; McCracken, H. J.; Pichon, C.; Le Borgne, D.] Univ Paris 06, Sorbonne Univ, 98b Bd Arago, F-75014 Paris, France; [Laigle, C.; McCracken, H. J.; Pichon, C.; Le Borgne, D.] CNRS, UMR 7095, IAP, 98b Bd Arago, F-75014 Paris, France; [Ilbert, O.; Davidzon, I.; Le Fevre, O.; Tasca, L.] Univ Aix Marseille, LAM, 38 Rue F Joliot Curie, F-13388 Marseille 13, France; [Ilbert, O.; Davidzon, I.; Le Fevre, O.; Tasca, L.] CNRS, UMR7326, 38 Rue F Joliot Curie, F-13388 Marseille 13, France; [Hsieh, B. C.; Lin, L.] Acad Sinica, Inst Astron & Astrophys, POB 23-141, Taipei 106, Taiwan; [Capak, P.] CALTECH, Pasadena, CA 91125 USA; [Hasinger, G.; Sanders, D. B.] Inst Astron, 2680 Woodlawn Dr, Honolulu, HI 96822 USA; [Silverman, J. D.] Univ Tokyo, Todai Inst Adv Study, Kavli Inst Phys & Math Universe WPI, Kashiwa, Chiba 2778583, Japan; [Pichon, C.] Univ Cambridge, Inst Astron, Madingley Rd, Cambridge CB3 0HA, England; [Coupon, J.] Univ Geneva, Astron Observ, Ch Ecogia 16, CH-1290 Versoix, Switzerland; [Aussel, H.; Chang, Y. -Y.; Le Floc'h, E.] Univ Paris 07, CNRS, CEA, Lab AIM Paris Saclay,UMR 7158,CE SACLAY, Bat 709, F-91191 Gif Sur Yvette, France; [Caputi, K.] Univ Groningen, Kapteyn Astron Inst, POB 800, NL-9700 AV Groningen, Netherlands; [Cassata, P.] Univ Valparaiso, Inst Fis & Astron, Av Gran Bretana, Valparaiso 1111, Chile; [Civano, F.; Marchesi, S.] Yale Ctr Astron & Astrophys, 260 Withney Ave, New Haven, CT 06520 USA; [Civano, F.] Smithsonian Astrophys Observ, 60 Garden St, Cambridge, MA 02138 USA; [Dunlop, J.] Univ Edinburgh, Royal Observ, Inst Astron, Edinburgh EH9 3HJ, Midlothian, Scotland; [Fynbo, J.; Milvang-Jensen, B.; Stockmann, M.; Toft, S.; Zabl, J.] Univ Copenhagen, Niels Bohr Inst, Dark Cosmol Ctr, Juliane Maries Vej 30, DK-2100 Copenhagen O, Denmark; [Kartaltepe, J. S.] Inst Technol, Sch Phys & Astron, 84 Lomb Mem Dr, Rochester, NY 14623 USA; [Koekemoer, A.] Space Telescope Sci Inst, 3700 San Martin Dr, Baltimore, MD 21218 USA; [Taniguchi, Y.] Kindai Univ, Fac Sci & Engn, Higashiosaka, Osaka, Japan; [Marchesi, S.] Univ Bologna, Dipartimento Fis & Astron, Via Ranzini 1, I-40127 Bologna, Italy; [Salvato, M.] Max Planck Inst Extraterr Phys, Giessenbachstr, D-85748 Garching, Germany; [Smolcic, V.] Univ Zagreb, Dept Phys, Bijenicka Cesta 32, HR-10000 Zagreb, Croatia; [Lilly, S.] Swiss Fed Inst Technol, Dept Phys, Inst Astron, Zurich, Switzerland; [Vaccari, Mattia] Univ Western Cape, Dept Phys, Astrophys Grp, Private Bag X17, ZA-7535 Cape Town, South Africa	Laigle, C (reprint author), Univ Paris 06, Sorbonne Univ, 98b Bd Arago, F-75014 Paris, France.; Laigle, C (reprint author), CNRS, UMR 7095, IAP, 98b Bd Arago, F-75014 Paris, France.		Vaccari, Mattia/R-3431-2016	Vaccari, Mattia/0000-0002-6748-0577; Koekemoer, Anton/0000-0002-6610-2048	ILP LABEX [ANR-10-LABX-63, ANR-11-IDEX-0004-02]; French Agence Nationale de la Recherche [ANR-13-BS05-0005]; "Programme national cosmologie et galaxies" (PNCG); French Agence Nationale de la Recherche; JSPS [26400221]; World Premier International Research Center Initiative (WPI); MEXT, Japan; CREST, JST; ERC-StG grant [EGGS-278202]; DNRF; ERC [648179]; Centre National dEtudes Spatiales (CNES); ESO [179.A-2005]; European Union [337595]	C.L. is supported by the ILP LABEX (under reference ANR-10-LABX-63 and ANR-11-IDEX-0004-02). This work is partially supported by the Spin(e) grants ANR-13-BS05-0005 of the French Agence Nationale de la Recherche. H.J.M.C.C. acknowledges financial support form the "Programme national cosmologie et galaxies" (PNCG). O.I. acknowledges the funding of the French Agence Nationale de la Recherche for the project "SAGACE". J.D.S. is supported by JSPS KAKENHI grant No. 26400221, the World Premier International Research Center Initiative (WPI), MEXT, Japan and by CREST, JST. B.M.J. and J.P.U.F. acknowledge support from the ERC-StG grant EGGS-278202. The Dark Cosmology Centre is funded by the DNRF. S.T. and M.S. acknowledge support from the ERC Consolidator Grant funding scheme (project ConTExt, grant No. 648179). This research is also partly supported by the Centre National dEtudes Spatiales (CNES). This work is based on data products from observations made with ESO Telescopes at the La Silla Paranal Observatory under ESO programme ID 179.A-2005 and on data products produced by TERAPIX and the Cambridge Astronomy Survey Unit on behalf of the UltraVISTA consortium. V.S. acknowledges the European Union's Seventh Framework program under grant agreement 337595.		119	53	53	1	6	IOP PUBLISHING LTD	BRISTOL	TEMPLE CIRCUS, TEMPLE WAY, BRISTOL BS1 6BE, ENGLAND	0067-0049	1538-4365		ASTROPHYS J SUPPL S	Astrophys. J. Suppl. Ser.	JUN	2016	224	2							24	10.3847/0067-0049/224/2/24		23	Astronomy & Astrophysics	Astronomy & Astrophysics	DS8DK	WOS:000381013200011		No	Y	N	2017-09-26	ASTROPHYSICAL JOURNAL SUPPLEMENT SERIES Volume: 224 Issue: 2 Article Number: 24 DOI: 10.3847/0067-0049/224/2/24 Published: 2016		0067-0049 eISSN: 1538-4365	Chile; Croatia; Denmark; France; Germany; Italy; Japan; Netherlands; South Africa; Switzerland; Taiwan; England; Scotland; USA	Chile; Croatia; Denmark; France; Germany; Italy; Japan; Netherlands; South Africa; Switzerland; Taiwan; England; Scotland; United States	Chile; Croatia; Denmark; France; Germany; Italy; Japan; Netherlands; South Africa; Switzerland; Taiwan; United Kingdom; United States	Chili; Croatie; Danemark; France; Allemagne; Italie; Japon; Pays-Bas; Afrique du Sud; Suisse; Taïwan, Province de Chine; Royaume-Uni; Etats-Unis	CHL; HRV; DNK; FRA; DEU; ITA; JPN; NLD; ZAF; CHE; TWN; GBR; USA
J	Harikane, Y; Ouchi, M; Ono, Y; More, S; Saito, S; Lin, YT; Coupon, J; Shimasaku, K; Shibuya, T; Price, PA; Lin, LW; Hsieh, BC; Ishigaki, M; Komiyama, Y; Silverman, J; Takata, T; Tamazawa, H; Toshikawa, J				Harikane, Yuichi; Ouchi, Masami; Ono, Yoshiaki; More, Surhud; Saito, Shun; Lin, Yen-Ting; Coupon, Jean; Shimasaku, Kazuhiro; Shibuya, Takatoshi; Price, Paul A.; Lin, Lihwai; Hsieh, Bau-Ching; Ishigaki, Masafumi; Komiyama, Yutaka; Silverman, John; Takata, Tadafumi; Tamazawa, Hiroko; Toshikawa, Jun			EVOLUTION OF STELLAR-TO-HALO MASS RATIO AT z=0-7 IDENTIFIED BY CLUSTERING ANALYSIS WITH THE HUBBLE LEGACY IMAGING AND EARLY SUBARU/HYPER SUPRIME-CAM SURVEY DATA	ASTROPHYSICAL JOURNAL			English	Article						galaxies: evolution; galaxies: formation; galaxies: high-redshift	LYMAN-BREAK GALAXIES; STAR-FORMING GALAXIES; DARK-MATTER HALOS; ULTRA DEEP FIELD; ULTRAVIOLET LUMINOSITY DENSITY; DIGITAL SKY SURVEY; OCCUPATION DISTRIBUTION; HIGH-REDSHIFT; LARGE-SCALE; FAINT GALAXIES	We present clustering analysis results from 10,381 Lyman break galaxies (LBGs) at z similar to 4-7, identified in the Hubble legacy deep imaging and new complimentary large-area Subaru/Hyper Suprime-Cam data. We measure the angular correlation functions of these LBGs at z similar to 4, 5, 6, and 7 and fit these measurements using halo occupation distribution (HOD) models that provide an estimate of halo masses, M-h similar to (1-20) x 10(11) M-circle dot. Our M-h estimates agree with those obtained by previous clustering studies in a UV-magnitude versus M-h plane and allow us to calculate stellar-to-halo mass ratios (SHMRs) of LBGs. By comparison with the z similar to 0 SHMR, we identify evolution of the SHMR from z similar to 0 to z similar to 4 and from z similar to 4 to z similar to 7 at the > 98% confidence levels. The SHMR decreases by a factor of similar to 2 from z similar to 0 to 4 and increases by a factor of similar to 4 from z similar to 4 to 7 at the dark matter halo mass of M-h similar to 10(11) M circle dot. We compare our SHMRs with results of a hydrodynamic simulation and a semianalytic model and find that these theoretical studies do not predict the SHMR increase from z similar to 4 to 7. We obtain the baryon conversion efficiency (BCE) of LBGs at z similar to 4 and find that the BCE increases with increasing dark matter halo mass. Finally, we compare our clustering+HOD estimates with results from abundance matching techniques and conclude that the M-h estimates of the clustering+HOD analyses agree with those of the simple abundance matching within a factor of 3, and that the agreement improves when using more sophisticated abundance matching techniques that include subhalos, incompleteness, and/or evolution in the star formation and stellar mass functions.	[Harikane, Yuichi; Ouchi, Masami; Ono, Yoshiaki; Shibuya, Takatoshi; Ishigaki, Masafumi; Tamazawa, Hiroko] Univ Tokyo, Inst Cosm Ray Res, 5-1-5 Kashiwanoha, Kashiwa, Chiba 2778582, Japan; [Harikane, Yuichi; Tamazawa, Hiroko] Univ Tokyo, Grad Sch Sci, Dept Phys, Bunkyo Ku, 7-3-1 Hongo, Tokyo 1130033, Japan; [Ouchi, Masami; More, Surhud; Saito, Shun; Silverman, John] Univ Tokyo, WPI, Kavli IPMU, Kavli Inst Phys & Math Universe, Kashiwa, Chiba 2778583, Japan; [Lin, Yen-Ting; Lin, Lihwai; Hsieh, Bau-Ching] Acad Sinica, Inst Astron & Astrophys, Taipei 106, Taiwan; [Coupon, Jean] Univ Geneva, Astron Observ, Ch Ecogia 16, CH-1290 Versoix, Switzerland; [Shimasaku, Kazuhiro] Univ Tokyo, Grad Sch Sci, Dept Astron, Bunkyo Ku, Tokyo 1130033, Japan; [Shimasaku, Kazuhiro] Univ Tokyo, Res Ctr Early Universe, Tokyo 1130033, Japan; [Price, Paul A.] Princeton Univ Observ, Peyton Hall, Princeton, NJ 08544 USA; [Komiyama, Yutaka; Takata, Tadafumi; Toshikawa, Jun] Natl Astron Observ, Mitaka, Tokyo 1818588, Japan	Harikane, Y (reprint author), Univ Tokyo, Inst Cosm Ray Res, 5-1-5 Kashiwanoha, Kashiwa, Chiba 2778582, Japan.; Harikane, Y (reprint author), Univ Tokyo, Grad Sch Sci, Dept Phys, Bunkyo Ku, 7-3-1 Hongo, Tokyo 1130033, Japan.	hari@icrr.u-tokyo.ac.jp		Toshikawa, Jun/0000-0001-5394-242X	3D-HST Treasury Program [GO 12177, 12328]; NASA [NAS5-26555]; National Aeronautics and Space Administration [NNX08AR22G]; National Science Foundation [AST-1238877]; World Premier International Research Center Initiative (WPI Initiative), MEXT, Japan; Japan Society for the Promotion of Science (JSPS) [23244025, 15H02064]; Hayakawa Satio Fund - Astronomical Society of Japan; Advanced Leading Graduate Course for Photon Science grant (ALPS); JSPS Research Fellowship for Young Scientists; KAKENHI [15K17600]	This work is based on observations taken by the 3D-HST Treasury Program (GO 12177 and 12328) and CANDELS Multi-Cycle Treasury Program with the NASA/ESA HST, which is operated by the Association of Universities for Research in Astronomy, Inc., under NASA contract NAS5-26555. This paper makes use of software developed for the Large Synoptic Survey Telescope. We thank the LSST Project for making their code available as free software at http://dm.lsstcorp.org.; The Pan-STARRS1 Surveys (PS1) have been made possible through contributions of the Institute for Astronomy, the University of Hawaii, the Pan-STARRS Project Office, the Max-Planck Society and its participating institutes, the Max Planck Institute for Astronomy, Heidelberg, and the Max Planck Institute for Extraterrestrial Physics, Garching, Johns Hopkins University, Durham University, the University of Edinburgh, Queen's University Belfast, the Harvard-Smithsonian Center for Astrophysics, the Las Cumbres Observatory Global Telescope Network Incorporated, the National Central University of Taiwan, the Space Telescope Science Institute, the National Aeronautics and Space Administration under Grant No. NNX08AR22G issued through the Planetary Science Division of the NASA Science Mission Directorate, the National Science Foundation under Grant No. AST-1238877, the University of Maryland, and Eotvos Lorand University (ELTE).; This work is supported by World Premier International Research Center Initiative (WPI Initiative), MEXT, Japan, KAKENHI (23244025) and (15H02064) Grant-in-Aid for Scientific Research (A) through Japan Society for the Promotion of Science (JSPS), and a grant from the Hayakawa Satio Fund awarded by the Astronomical Society of Japan. Y.H. is supported by an Advanced Leading Graduate Course for Photon Science grant (ALPS) and the JSPS Research Fellowship for Young Scientists. S.M. is supported by KAKENHI (15K17600).		131	11	11	0	0	IOP PUBLISHING LTD	BRISTOL	TEMPLE CIRCUS, TEMPLE WAY, BRISTOL BS1 6BE, ENGLAND	0004-637X	1538-4357		ASTROPHYS J	Astrophys. J.	APR 20	2016	821	2							123	10.3847/0004-637X/821/2/123		23	Astronomy & Astrophysics	Astronomy & Astrophysics	DN5JM	WOS:000377102700052		No			2017-09-26	ASTROPHYSICAL JOURNAL Volume: 821 Issue: 2 Article Number: 123 DOI: 10.3847/0004-637X/821/2/123 Published: 2016		0004-637X eISSN: 1538-4357	Japan; Switzerland; Taiwan; USA	Japan; Switzerland; Taiwan; United States	Japan; Switzerland; Taiwan; United States	Japon; Suisse; Taïwan, Province de Chine; Etats-Unis	JPN; CHE; TWN; USA
