PT	AU	BA	BE	GP	AF	BF	CA	TI	SO	SE	BS	LA	DT	CT	CY	CL	SP	HO	DE	ID	AB	C1	RP	EM	RI	OI	FU	FX	CR	NR	TC	Z9	U1	U2	PU	PI	PA	SN	EI	BN	J9	JI	PD	PY	VL	IS	PN	SU	SI	MA	BP	EP	AR	DI	D2	PG	WC	SC	GA	UT	PM	OA	HC	HP	DA	Source	Conference	Issn	PaysENG_I	PaysENG_C	PaysENG_R	PaysFRE_R	PaysISO3
J	Santana, FA; Munoz, RR; Geha, M; Cote, P; Stetson, P; Simon, JD; Djorgovski, SG				Santana, Felipe A.; Munoz, Ricardo R.; Geha, Marla; Cote, Patrick; Stetson, Peter; Simon, Joshua D.; Djorgovski, S. G.			A MEGACAM SURVEY OF OUTER HALO SATELLITES. II. BLUE STRAGGLERS IN THE LOWEST STELLAR DENSITY SYSTEMS	ASTROPHYSICAL JOURNAL			English	Article						blue stragglers; galaxies: dwarf; galaxies: stellar content; Galaxy: halo; globular clusters: general; techniques: photometric	DWARF SPHEROIDAL GALAXY; MILKY-WAY SATELLITE; GALACTIC GLOBULAR-CLUSTERS; STAR-FORMATION HISTORY; CANES VENATICI-I; URSA-MAJOR II; VARIABLE-STARS; NGC 188; COMA BERENICES; MAIN-SEQUENCE	We present a homogeneous study of blue straggler stars across 10 outer halo globular clusters, 3 classical dwarf spheroidal galaxies, and 9 ultra-faint galaxies based on deep and wide-field photometric data taken with MegaCam on the Canada-France-Hawaii Telescope. We find blue straggler stars to be ubiquitous among these Milky Way satellites. Based on these data, we can test the importance of primordial binaries or multiple systems on blue straggler star formation in low-density environments. For the outer halo globular clusters, we find an anti-correlation between the specific frequency of blue stragglers and absolute magnitude, similar to that previously observed for inner halo clusters. When plotted against density and encounter rate, the frequency of blue stragglers is well fit by a single trend with a smooth transition between dwarf galaxies and globular clusters; this result points to a common origin for these satellites' blue stragglers. The fraction of blue stragglers stays constant and high in the low encounter rate regime spanned by our dwarf galaxies, and decreases with density and encounter rate in the range spanned by our globular clusters. We find that young stars can mimic blue stragglers in dwarf galaxies only if their ages are 2.5 +/- 0.5 Gyr and they represent similar to 1%-7% of the total number of stars, which we deem highly unlikely. These results point to mass-transfer or mergers of primordial binaries or multiple systems as the dominant blue straggler formation mechanism in low-density systems.	[Santana, Felipe A.; Munoz, Ricardo R.] Univ Chile, Dept Astron, Santiago, Chile; [Santana, Felipe A.; Munoz, Ricardo R.; Geha, Marla] Yale Univ, Dept Astron, New Haven, CT 06520 USA; [Cote, Patrick; Stetson, Peter] Natl Res Council Canada, Herzberg Inst Astrophys, Victoria, BC V9E 2E7, Canada; [Simon, Joshua D.] Observ Carnegie Inst Washington, Pasadena, CA 91101 USA; [Djorgovski, S. G.] CALTECH, Dept Astron, Pasadena, CA USA	Santana, FA (reprint author), Univ Chile, Dept Astron, Camino Observ 1515, Santiago, Chile.	fsantana@das.uchile.cl	Munoz, Ricardo/I-5735-2016		CONICYT-PCHA/Doctorado Nacional [2010-21100133]; CONICYT Anillo project [ACT-1122, BASAL PFB-06]; FONDECYT [1120013]; National Science Foundation [AST-0908752]; Alfred P. Sloan Foundation; NSF [AST-0909182]; Ajax Foundation	We thank the referee for very useful comments that helped improve this paper significantly. F. A. S. thanks Andres Guzman for useful discussions. F. A. S. acknowledges support from CONICYT-PCHA/Doctorado Nacional/2010-21100133. R. R. M. acknowledges partial support from CONICYT Anillo project ACT-1122 and project BASAL PFB-06 as well as from the FONDECYT project No 1120013. M. G. acknowledges support from the National Science Foundation under award number AST-0908752 and the Alfred P. Sloan Foundation. S. G. D. was supported in part by the NSF grant AST-0909182 and by the Ajax Foundation. This work was supported in part by the facilities and staff of the Yale University Faculty of Arts and Sciences High Performance Computing Center.		79	14	14	0	5	IOP PUBLISHING LTD	BRISTOL	TEMPLE CIRCUS, TEMPLE WAY, BRISTOL BS1 6BE, ENGLAND	0004-637X			ASTROPHYS J	Astrophys. J.	SEP 10	2013	774	2							106	10.1088/0004-637X/774/2/106		10	Astronomy & Astrophysics	Astronomy & Astrophysics	211EW	WOS:000323888900015		No			2017-09-26	ASTROPHYSICAL JOURNAL Volume: 774 Issue: 2 Article Number: 106 DOI: 10.1088/0004-637X/774/2/106 Published: 2013		0004-637X	Canada; Chile; USA	Canada; Chile; United States	Canada; Chile; United States	Canada; Chili; Etats-Unis	CAN; CHL; USA
J	Melnyk, O; Plionis, M; Elyiv, A; Salvato, M; Chiappetti, L; Clerc, N; Gandhi, P; Pierre, M; Sadibekova, T; Pospieszalska-Surdej, A; Surdej, J				Melnyk, O.; Plionis, M.; Elyiv, A.; Salvato, M.; Chiappetti, L.; Clerc, N.; Gandhi, P.; Pierre, M.; Sadibekova, T.; Pospieszalska-Surdej, A.; Surdej, J.			Classification and environmental properties of X-ray selected point-like sources in the XMM-LSS field	ASTRONOMY & ASTROPHYSICS			English	Article						quasars: general; X-rays: general; galaxies: active; X-rays: galaxies	ACTIVE GALACTIC NUCLEI; DUST-OBSCURED GALAXIES; SCALE STRUCTURE SURVEY; NEWTON-DEEP-FIELD; RADIO-LOUD AGN; REDSHIFT EVOLUTION; COSMOS FIELD; OPTICAL IDENTIFICATIONS; PHOTOMETRIC REDSHIFTS; ANGULAR-CORRELATIONS	Context. The XMM-Large Scale Structure survey, covering an area of 11.1 sq. deg., contains more than 6000 X-ray point-like sources detected with the XMM-Newton to a flux of 3 x 10(-15) erg s(-1) cm(-2) in the [0.5-2] keV band. The vast majority of these sources have optical (CFHTLS), infrared (SWIRE IRAC and MIPS), near-infrared (UKIDSS), and/or ultraviolet (GALEX) counterparts. Aims. We wish to investigate the environmental properties of the different types of the XMM-LSS X-ray sources by defining their environment using the i'-band CFHTLS W1 catalog of optical galaxies to a magnitude limit of 23.5 mag. Methods. We have classified 4435 X-ray selected sources on the basis of their spectra, SEDs, and X-ray luminosity, and estimated their photometric redshifts, which have a 4-11 band photometry with an accuracy of sigma(Delta z/(1+zsp)) = 0.076 with 22.6% outliers for i' < 26 mag. We estimated the local overdensities of 777 X-ray sources that have spectro-z or photo-z calculated by using more than seven bands (accuracy of sigma(Delta z/(1+zsp)) = 0.061 with 13.8% outliers) within the volume-limited region defined by 0.1 <= z <= 0.85 and -23.5 < M-i' < -20. Results. Although X-ray sources may be found in variety of environments, a high fraction (greater than or similar to 55-60%), as verified by comparing with the random expectations, reside in overdense regions. The galaxy overdensities within which X-ray sources reside show a positive recent redshift evolution (at least for the range studied; z less than or similar to 0.85). We also find that X-ray selected galaxies, when compared to AGN, inhabit significantly higher galaxy overdensities, although their spatial extent appear to be smaller than that of AGN. Hard AGN (HR >= -0.2) are located in more overdense regions than soft AGN (HR < -0.2), which is clearly seen in both redshift ranges, although it appears to be stronger in the higher redshift range (0.55 < z < 0.85). Furthermore, the galaxy overdensities (with delta greater than or similar to 1.5) within which soft AGN are embedded appear to evolve more rapidly compared to the corresponding overdensities around hard AGN.	[Melnyk, O.; Elyiv, A.; Pospieszalska-Surdej, A.; Surdej, J.] Univ Liege, Inst Astrophys & Geophys, B-4000 Liege, Belgium; [Melnyk, O.] Taras Shevchenko Natl Univ Kyiv, Astron Observ, UA-04053 Kiev, Ukraine; [Plionis, M.] Aristotle Univ Thessaloniki, Dept Phys, Thessaloniki 54124, Greece; [Plionis, M.] Inst Nacl Astrofis Opt & Electr, Puebla 72000, Mexico; [Elyiv, A.] Ukrainian Acad Sci, Main Astron Observ, UA-03680 Kiev, Ukraine; [Salvato, M.; Clerc, N.] Max Planck Inst Extraterr Phys, D-85748 Garching, Germany; [Salvato, M.] Excellence Cluster, D-85748 Garching, Germany; [Chiappetti, L.] INAF IASF Milano, I-20133 Milan, Italy; [Gandhi, P.] Japan Aerosp Explorat Agcy, Inst Space & Astronaut Sci, Chuo Ku, Sagamihara, Kanagawa 2525210, Japan; [Pierre, M.; Sadibekova, T.] CEA Saclay, DSM Irfu SAp, F-91191 Gif Sur Yvette, France	Melnyk, O (reprint author), Univ Liege, Inst Astrophys & Geophys, B-4000 Liege, Belgium.	melnykol@gmail.com	Plionis, Manolis/K-4354-2013	Chiappetti, Lucio/0000-0001-7857-7908	Spitzer Space Telescope Legacy Science Program; NASA; Jet Propulsion Laboratory, California Institute of Technology under NASA [1407]; UK Particle Physics and Astronomy Research Council (PPARC); UK Science and Technology Facilities Council (STFC); NASA [NAS5-26555]; NASA Office of Space Science [NNX09AF08G]; Communaute francaise de Belgique - Actions de recherche concertees - Academie universitaire Wallonie-Europe; ESA Member States	We are grateful to Olivier Ilbert for help with LePhare and to Mari Polletta for useful suggestions. The data used in this work were obtained with XMM-Newton, an ESA science mission with instruments and contributions directly funded by ESA Member States and NASA. This work is based on observations obtained with MegaPrime/MegaCam, a joint project of CFHT and CEA/DAPNIA, at the Canada-France-Hawaii Telescope (CFHT), which is operated by the National Research Council (NRC) of Canada, the Institut National des Sciences de l'Univers of the Centre National de la Recherche Scientifique (CNRS) of France, and the University of Hawaii. This work is based in part on data products produced at TERAPIX and the Canadian Astronomy Data Centre as part of the Canada-France-Hawaii Telescope Legacy Survey, a collaborative project of NRC and CNRS. We used the data obtained with the Spitzer Space Telescope, which is operated by the Jet Propulsion Laboratory, California Institute of Technology under NASA. Support for this work, part of the Spitzer Space Telescope Legacy Science Program, was provided by NASA through an award issued by the Jet Propulsion Laboratory, California Institute of Technology under NASA contract 1407. This work is in part based on data collected within the UKIDSS survey. The UKIDSS project uses the UKIRT Wide Field Camera funded by the UK Particle Physics and Astronomy Research Council (PPARC). Financial resources for WFCAM Science Archive development were provided by the UK Science and Technology Facilities Council (STFC; formerly by PPARC). GALEX is a NASA mission managed by the Jet Propulsion Laboratory. GALEX data used in this paper were obtained from the Multimission Archive at the Space Telescope Science Institute (MAST). STScI is operated by the Association of Universities for Research in Astronomy, Inc. under NASA contract NAS5-26555. Support for MAST for non-HST data is provided by the NASA Office of Space Science via grant NNX09AF08G and by other grants and contracts. This research has made use of the NASA/IPAC Extragalactic Database (NED), which is operated by the Jet Propulsion Laboratory, California Institute of Technology, under contract with the National Aeronautics and Space Administration. O.M., A. E. and J.S. acknowledge support from the ESA PRODEX Programmes "XMM-LSS" and "XXL" and from the Belgian Federal Science Policy Office. They also acknowledge support from the Communaute francaise de Belgique - Actions de recherche concertees - Academie universitaire Wallonie-Europe.		80	9	9	0	2	EDP SCIENCES S A	LES ULIS CEDEX A	17, AVE DU HOGGAR, PA COURTABOEUF, BP 112, F-91944 LES ULIS CEDEX A, FRANCE	0004-6361	1432-0746		ASTRON ASTROPHYS	Astron. Astrophys.	SEP	2013	557								A81	10.1051/0004-6361/201220624		14	Astronomy & Astrophysics	Astronomy & Astrophysics	228TC	WOS:000325211900021		No			2017-09-26	ASTRONOMY & ASTROPHYSICS Volume: 557 Article Number: A81 DOI: 10.1051/0004-6361/201220624 Published: 2013		0004-6361 eISSN: 1432-0746	Belgium; France; Germany; Greece; Italy; Japan; Mexico; Ukraine	Belgium; France; Germany; Greece; Italy; Japan; Mexico; Ukraine	Belgium; France; Germany; Greece; Italy; Japan; Mexico; Ukraine	Belgique; France; Allemagne; Grèce; Italie; Japon; Mexique; Ukraine	BEL; FRA; DEU; GRC; ITA; JPN; MEX; UKR
J	Heymans, C; Grocutt, E; Heavens, A; Kilbinger, M; Kitching, TD; Simpson, F; Benjamin, J; Erben, T; Hildebrandt, H; Hoekstra, H; Mellier, Y; Miller, L; Van Waerbeke, L; Brown, ML; Coupon, J; Fu, L; Harnois-Deraps, J; Hudson, MJ; Kuijken, K; Rowe, B; Schrabback, T; Semboloni, E; Vafaei, S; Velander, M				Heymans, Catherine; Grocutt, Emma; Heavens, Alan; Kilbinger, Martin; Kitching, Thomas D.; Simpson, Fergus; Benjamin, Jonathan; Erben, Thomas; Hildebrandt, Hendrik; Hoekstra, Henk; Mellier, Yannick; Miller, Lance; Van Waerbeke, Ludovic; Brown, Michael L.; Coupon, Jean; Fu, Liping; Harnois-Deraps, Joachim; Hudson, Michael J.; Kuijken, Konrad; Rowe, Barnaby; Schrabback, Tim; Semboloni, Elisabetta; Vafaei, Sanaz; Velander, Malin			CFHTLenS tomographic weak lensing cosmological parameter constraints: Mitigating the impact of intrinsic galaxy alignments	MONTHLY NOTICES OF THE ROYAL ASTRONOMICAL SOCIETY			English	Article						cosmology: observations	BARYON ACOUSTIC-OSCILLATIONS; SHEAR CORRELATION-FUNCTIONS; DARK-ENERGY CONSTRAINTS; DIGITAL SKY SURVEY; COSMIC SHEAR; POWER SPECTRUM; COVARIANCE-MATRIX; DENSITY CORRELATION; ANGULAR-MOMENTUM; STATISTICS	We present a finely binned tomographic weak lensing analysis of the Canada-France-Hawaii Telescope Lensing Survey (CFHTLenS) mitigating contamination to the signal from the presence of intrinsic galaxy alignments via the simultaneous fit of a cosmological model and an intrinsic alignment model. CFHTLenS spans 154 square degrees in five optical bands, with accurate shear and photometric redshifts for a galaxy sample with a median redshift of z(m) = 0.70. We estimate the 21 sets of cosmic shear correlation functions associated with six redshift bins, each spanning the angular range of 1.5 < theta < 35 arcmin. We combine this CFHTLenS data with auxiliary cosmological probes: the cosmic microwave background with data from WMAP7, baryon acoustic oscillations with data from Baryon Oscillation Spectroscopic Survey and a prior on the Hubble constant from the Hubble Space Telescope distance ladder. This leads to constraints on the normalization of the matter power spectrum Sigma(8) = 0.799 +/- 0.015 and the matter density parameter (m) = 0.271 +/- 0.010 for a flat Lambda cold dark matter (Lambda CDM) cosmology. For a flat wCDM cosmology, we constrain the dark energy equation-of-state parameter w = -1.02 +/- 0.09. We also provide constraints for curved Lambda CDM and wCDM cosmologies. We find the intrinsic alignment contamination to be galaxy-type dependent with a significant intrinsic alignment signal found for early-type galaxies, in contrast to the late-type galaxy sample for which the intrinsic alignment signal is found to be consistent with zero.	[Heymans, Catherine; Grocutt, Emma; Heavens, Alan; Kitching, Thomas D.; Simpson, Fergus] Univ Edinburgh, Royal Observ, Scottish Univ Phys Alliance, Inst Astron, Edinburgh EH9 3HJ, Midlothian, Scotland; [Heavens, Alan] Univ London Imperial Coll Sci Technol & Med, Blackett Lab, Imperial Ctr Inference & Cosmol, London SW7 2AZ, England; [Kilbinger, Martin; Mellier, Yannick] CEA Saclay, Serv Astrophys SAp, F-91191 Gif Sur Yvette, France; [Kilbinger, Martin] Excellence Cluster Univ, D-85748 Garching, Germany; [Kilbinger, Martin] Univ Munich, Univ Sternwarte, D-81679 Munich, Germany; [Kilbinger, Martin; Mellier, Yannick] Univ Paris 06, Inst Astrophys Paris, F-75014 Paris, France; [Kitching, Thomas D.] Univ Coll London, Mullard Space Sci Lab, Dorking RH5 6NT, Surrey, England; [Benjamin, Jonathan; Hildebrandt, Hendrik; Van Waerbeke, Ludovic; Vafaei, Sanaz] Univ British Columbia, Dept Phys & Astron, Vancouver, BC V6T 1Z1, Canada; [Erben, Thomas; Hildebrandt, Hendrik] Univ Bonn, Argelander Inst Astron, D-53121 Bonn, Germany; [Hoekstra, Henk; Kuijken, Konrad; Schrabback, Tim; Semboloni, Elisabetta; Velander, Malin] Leiden Univ, Leiden Observ, NL-2333 CA Leiden, Netherlands; [Hoekstra, Henk] Univ Victoria, Dept Phys & Astron, Victoria, BC V8P 5C2, Canada; [Miller, Lance; Velander, Malin] Univ Oxford, Dept Phys, Oxford OX1 3RH, England; [Brown, Michael L.] Univ Manchester, Jodrell Bank, Ctr Astrophys, Manchester M13 9PL, Lancs, England; [Coupon, Jean] Acad Sinica, Inst Astron & Astrophys, Taipei 10617, Taiwan; [Fu, Liping] Shanghai Normal Univ, Key Lab Astrophys, Shanghai 200234, Peoples R China; [Harnois-Deraps, Joachim] Univ Toronto, Canadian Inst Theoret Astrophys, Toronto, ON M5S 3H8, Canada; [Harnois-Deraps, Joachim] Univ Toronto, Dept Phys, Toronto, ON M5S 1A7, Canada; [Hudson, Michael J.] Univ Waterloo, Dept Phys & Astron, Waterloo, ON N2L 3G1, Canada; [Hudson, Michael J.] Perimeter Inst Theoret Phys, Waterloo, ON N2L 1Y5, Canada; [Rowe, Barnaby] UCL, Dept Phys & Astron, London WC1E 6BT, England; [Rowe, Barnaby] CALTECH, Pasadena, CA 91125 USA; [Schrabback, Tim] Stanford Univ, Kavli Inst Particle Astrophys & Cosmol, Stanford, CA 94305 USA	Heymans, C (reprint author), Univ Edinburgh, Royal Observ, Scottish Univ Phys Alliance, Inst Astron, Blackford Hill, Edinburgh EH9 3HJ, Midlothian, Scotland.	heymans@roe.ac.uk	Hudson, Michael/H-3238-2012; Fu, Liping/B-3051-2012	Hudson, Michael/0000-0002-1437-3786; Rowe, Barnaby/0000-0002-7042-9174; Kilbinger, Martin/0000-0001-9513-7138; Hoekstra, Henk/0000-0002-0641-3231; Kuijken, Konrad/0000-0002-3827-0175	European Research Council [240185, 279396, 280127, 240672]; STFC; Royal Society University Research Fellowship; Deutsche Forschungsgemeinschaft [ER 327/3-1]; Transregional Collaborative Research Centre [TR 33]; Marie Curie IOF [252760]; CITA National Fellowship; DFG [Hi 1495/2-1]; Marie Curie IRG [230924]; Netherlands Organization for Scientific Research [639.042.814]; CNRS/INSU (Institut National des Sciences de l'Univers); Programme National Galaxies et Cosmologie (PNCG); Natural Sciences and Engineering Research Council of Canada (NSERC); Canadian Institute for Advanced Research (CIfAR); STFC Advanced Fellowship [ST/I005129/1]; NSFC [11103012, 10878003, 12ZZ134]; SMEC [10CG46]; STCSM [11290706600]; Pujiang Program [12PJ1406700]; NSF [AST-0444059-001]; SAO [GO0-11147A]; Netherlands Organization for Scientific Research (NWO); Beecroft Institute for Particle Astrophysics and Cosmology	CH, EG, FS, HHo, ES, MLB and BR acknowledge support from the European Research Council under the EC FP7 grant numbers 240185 (CH, EG, FS), 279396 (HHo, ES), 280127 (MLB) and 240672 (BR). EG also acknowledges the award of an STFC studentship. TDK acknowledges support from a Royal Society University Research Fellowship. TE is supported by the Deutsche Forschungsgemeinschaft through project ER 327/3-1 and is supported by the Transregional Collaborative Research Centre TR 33 - 'The Dark Universe'. HHi is supported by the Marie Curie IOF 252760, a CITA National Fellowship and the DFG grant Hi 1495/2-1. HHo also acknowledges support from Marie Curie IRG grant 230924 and, with ES, the Netherlands Organization for Scientific Research grant number 639.042.814. YM acknowledges support from CNRS/INSU (Institut National des Sciences de l'Univers) and the Programme National Galaxies et Cosmologie (PNCG). LVW acknowledges support from the Natural Sciences and Engineering Research Council of Canada (NSERC) and the Canadian Institute for Advanced Research (CIfAR, Cosmology and Gravity programme). MLB also acknowledges the award of an STFC Advanced Fellowship (ST/I005129/1). LF acknowledges support from NSFC grants 11103012 and 10878003, Innovation Program 12ZZ134, Chen Guang project 10CG46 of SMEC, STCSM grant 11290706600 and the Pujiang Program 12PJ1406700. MJH acknowledges support from the Natural Sciences and Engineering Research Council of Canada (NSERC). TS acknowledges support from NSF through grant AST-0444059-001, SAO through grant GO0-11147A and NWO. MV acknowledges support from the Netherlands Organization for Scientific Research (NWO) and from the Beecroft Institute for Particle Astrophysics and Cosmology.		93	192	192	0	3	OXFORD UNIV PRESS	OXFORD	GREAT CLARENDON ST, OXFORD OX2 6DP, ENGLAND	0035-8711			MON NOT R ASTRON SOC	Mon. Not. Roy. Astron. Soc.	JUL	2013	432	3					2433	2453		10.1093/mnras/stt601		21	Astronomy & Astrophysics	Astronomy & Astrophysics	165AW	WOS:000320455800043		No	Y	N	2017-09-26	MONTHLY NOTICES OF THE ROYAL ASTRONOMICAL SOCIETY Volume: 432 Issue: 3 Pages: 2433-2453 DOI: 10.1093/mnras/stt601 Published: 2013		0035-8711	Canada; France; Germany; Netherlands; Peoples R China; Taiwan; England; Scotland; USA	Canada; France; Germany; Netherlands; People's Republic of China; Taiwan; England; Scotland; United States	Canada; France; Germany; Netherlands; People's Republic of China; Taiwan; United Kingdom; United States	Canada; France; Allemagne; Pays-Bas; Chine; Taïwan, Province de Chine; Royaume-Uni; Etats-Unis	CAN; FRA; DEU; NLD; CHN; TWN; GBR; USA
