"Ut";"Pm";"Ti";"Py";"Au";"Af";"Source";"La";"Dt";"Ab";"De";"Id";"DiscESI";"Wc";"C1";"Rp";"PaysENGCorrige";"PaysENGRegroupe";"PaysENGISO";"Tc";"So";"Se";"Ct";"Cy";"Cl";"Vl";"Is";"Bp";"Ep";"Ar";"Di";"Sn";"Ei";"Bn";"Issn";"Conference";"CoopInt";"CoopIntOui";"Cnrs";"CNRSOui";"LibelleCode";"LibelleCode2015";"CodeCNRS";"CodeCNRS2015"
"WOS:000284104000016";"20534600";"Are snake populations in widespread decline?";"2010";"Reading, CJ; Luiselli, LM; Akani, GC; Bonnet, X; Amori, G; Ballouard, JM; Filippi, E; Naulleau, G; Pearson, D; Rugiero, L";"Reading, C. J.; Luiselli, L. M.; Akani, G. C.; Bonnet, X.; Amori, G.; Ballouard, J. M.; Filippi, E.; Naulleau, G.; Pearson, D.; Rugiero, L.";"BIOLOGY LETTERS Volume: 6 Issue: 6 Pages: 777-780 Published: 2010";"English";"Article";"Long-term studies have revealed population declines in fishes, amphibians, reptiles, birds and mammals. In birds, and particularly amphibians, these declines are a global phenomenon whose causes are often unclear. Among reptiles, snakes are top predators and therefore a decline in their numbers may have serious consequences for the functioning of many ecosystems. Our results show that, of 17 snake populations (eight species) from the UK, France, Italy, Nigeria and Australia, 11 have declined sharply over the same relatively short period of time with five remaining stable and one showing signs of a marginal increase. Although the causes of these declines are currently unknown, we suspect that they are multi-faceted (such as habitat quality deterioration, prey availability), and with a common cause, e.g. global climate change, at their root.";"snakes; sharp population declines; carrying capacity; global climate change";"AMPHIBIAN DECLINES; TRENDS; USA; CALIFORNIA";"Biology & Biochemistry; Environment/Ecology; Plant & Animal Science";"Biology; Ecology; Evolutionary Biology";"[Reading, C. J.] Ctr Ecol & Hydrol, Wallingford OX10 8BB, Oxon, England; [Luiselli, L. M.; Rugiero, L.] DEMETRA, Inst Environm Studies, I-00198 Rome, Italy; [Akani, G. C.] Rivers State Univ Sci & Technol, Dept Appl & Environm Biol, Port Harcourt, Rivers State, Nigeria; [Bonnet, X.; Ballouard, J. M.; Naulleau, G.] CNRS, Ctr Etud Biol Chize, F-79360 Villiers En Bois, France; [Amori, G.] Inst Ecosyst Studies, CNR, I-00161 Rome, Italy; [Pearson, D.] Dept Environm & Conservat, Wanneroo, WA 6946, Australia";"Reading, CJ (reprint author), Ctr Ecol & Hydrol, Benson Lane, Wallingford OX10 8BB, Oxon, England.";"Australia; France; Italy; Nigeria; United Kingdom";"Australia; France; Italy; Nigeria; United Kingdom";"AUS; FRA; GBR; ITA; NGA";"73";"BIOLOGY LETTERS";"";"";"";"";"6";"6";"777";"780";"";"10.1098/rsbl.2010.0373";"1744-9561";"";"";"1744-9561";"";"oui";"1";"oui";"1";"Centre d'études biologiques de Chizé (CEBC), UPR1934";"Centre d'études biologiques de Chizé (CEBC), UMR7372";"UPR1934";"UMR7372"
"WOS:000285639400001";"";"POSSIBLE ROLE OF WETLANDS, PERMAFROST, AND METHANE HYDRATES IN THE METHANE CYCLE UNDER FUTURE CLIMATE CHANGE: A REVIEW";"2010";"O'Connor, FM; Boucher, O; Gedney, N; Jones, CD; Folberth, GA; Coppell, R; Friedlingstein, P; Collins, WJ; Chappellaz, J; Ridley, J; Johnson, CE";"O'Connor, Fiona M.; Boucher, O.; Gedney, N.; Jones, C. D.; Folberth, G. A.; Coppell, R.; Friedlingstein, P.; Collins, W. J.; Chappellaz, J.; Ridley, J.; Johnson, C. E.";"REVIEWS OF GEOPHYSICS Volume: 48 Article Number: RG4005 Published: 2010";"English";"Review";"We have reviewed the available scientific literature on how natural sources and the atmospheric fate of methane may be affected by future climate change. We discuss how processes governing methane wetland emissions, permafrost thawing, and destabilization of marine hydrates may affect the climate system. It is likely that methane wetland emissions will increase over the next century. Uncertainties arise from the temperature dependence of emissions and changes in the geographical distribution of wetland areas. Another major concern is the possible degradation or thaw of terrestrial permafrost due to climate change. The amount of carbon stored in permafrost, the rate at which it will thaw, and the ratio of methane to carbon dioxide emissions upon decomposition form the main uncertainties. Large amounts of methane are also stored in marine hydrates, and they could be responsible for large emissions in the future. The time scales for destabilization of marine hydrates are not well understood and are likely to be very long for hydrates found in deep sediments but much shorter for hydrates below shallow waters, such as in the Arctic Ocean. Uncertainties are dominated by the sizes and locations of the methane hydrate inventories, the time scales associated with heat penetration in the ocean and sediments, and the fate of methane released in the seawater. Overall, uncertainties are large, and it is difficult to be conclusive about the time scales and magnitudes of methane feedbacks, but significant increases in methane emissions are likely, and catastrophic emissions cannot be ruled out. We also identify gaps in our scientific knowledge and make recommendations for future research and development in the context of Earth system modeling.";"";"GLOBAL CARBON-CYCLE; ICE-CORE RECORD; ORGANIC-COMPOUND EMISSIONS; ATMOSPHERIC CH4 GRADIENT; INTERANNUAL GROWTH-RATE; LAND-SURFACE SCHEME; PROCESS-BASED MODEL; SUB-ARCTIC YUKON; GAS-HYDRATE; NATURAL WETLANDS";"Geosciences";"Geochemistry & Geophysics";"[O'Connor, Fiona M.; Boucher, O.; Jones, C. D.; Folberth, G. A.; Collins, W. J.; Ridley, J.; Johnson, C. E.] Met Off Hadley Ctr, Exeter EX1 3PB, Devon, England; [Gedney, N.] Met Off Hadley Ctr, Joint Ctr Hydrometeorol Res, Crowmarsh Gifford OX10 8BB, England; [Coppell, R.] Univ Leeds, Sch Geog, Leeds LS2 9JT, W Yorkshire, England; [Friedlingstein, P.] Univ Exeter, Coll Engn Math & Phys Sci, Exeter EX4 4QF, Devon, England; [Chappellaz, J.] Univ Grenoble, CNRS, Lab Glaciol & Geophys Environm, F-38400 St Martin Dheres, France";"O'Connor, FM (reprint author), Met Off Hadley Ctr, FitzRoy Rd, Exeter EX1 3PB, Devon, England.";"France; United Kingdom";"France; United Kingdom";"FRA; GBR";"57";"REVIEWS OF GEOPHYSICS";"";"";"";"";"48";"";"";"";"RG4005";"10.1029/2010RG000326";"8755-1209";"1944-9208";"";"8755-1209 eISSN: 1944-9208";"";"oui";"1";"oui";"1";"Laboratoire de glaciologie et géophysique de l'environnement (LGGE), UMR5183";"Laboratoire de glaciologie et géophysique de l'environnement (LGGE), UMR5183";"UMR5183";"UMR5183"
"WOS:000284054700006";"20630883";"Periodic climate cooling enhanced natural disasters and wars in China during AD 10-1900";"2010";"Zhang, ZB; Tian, HD; Cazelles, B; Kausrud, KL; Brauning, A; Guo, F; Stenseth, NC";"Zhang, Zhibin; Tian, Huidong; Cazelles, Bernard; Kausrud, Kyrre L.; Braeuning, Achim; Guo, Fang; Stenseth, Nils Chr";"PROCEEDINGS OF THE ROYAL SOCIETY B-BIOLOGICAL SCIENCES Volume: 277 Issue: 1701 Pages: 3745-3753 Published: 2010";"English";"Article";"Recent studies have linked climatic and social instabilities in ancient China; the underlying causal mechanisms have, however, often not been quantitatively assessed. Here, using historical records and palaeoclimatic reconstructions during AD 10-1900, we demonstrate that war frequency, price of rice, locust plague, drought frequency, flood frequency and temperature in China show two predominant periodic bands around 160 and 320 years where they interact significantly with each other. Temperature cooling shows direct positive association with the frequency of external aggression war to the Chinese dynasties mostly from the northern pastoral nomadic societies, and indirect positive association with the frequency of internal war within the Chinese dynasties through drought and locust plagues. The collapses of the agricultural dynasties of the Han, Tang, Song and Ming are more closely associated with low temperature. Our study suggests that food production during the last two millennia has been more unstable during cooler periods, resulting in more social conflicts owing to rebellions within the dynasties or/and southward aggressions from northern pastoral nomadic societies in ancient China.";"global warming; war cycle; drought/flood; locust plague; southward migration; human ecology";"TIME-SERIES; TEMPERATURE; HISTORY; RECORD; MODEL; CYCLE; SUN";"Biology & Biochemistry; Environment/Ecology; Plant & Animal Science";"Biology; Ecology; Evolutionary Biology";"[Zhang, Zhibin; Tian, Huidong] Chinese Acad Sci, Inst Zool, State Key Lab Integrated Management Pest Insects, Beijing 100101, Peoples R China; [Kausrud, Kyrre L.; Stenseth, Nils Chr] Univ Oslo, Dept Biol, CEES, N-0316 Oslo, Norway; [Cazelles, Bernard] Ecole Normale Super, UPMC CNRS ENS, UMR 7625, F-75230 Paris, France; [Tian, Huidong] Chinese Acad Sci, Grad Univ, Beijing 100049, Peoples R China; [Cazelles, Bernard] IRD UPMC, UMI 209, F-93142 Bondy, France; [Braeuning, Achim] Univ Erlangen Nurnberg, Inst Geog, D-91054 Erlangen, Germany; [Guo, Fang] Chinese Acad Social Sci, Inst World Hist, Beijing 100732, Peoples R China";"Zhang, ZB (reprint author), Chinese Acad Sci, Inst Zool, State Key Lab Integrated Management Pest Insects, Beijing 100101, Peoples R China.";"France; Germany; Norway; People's Republic of China";"France; Germany; Norway; People's Republic of China";"CHN; DEU; FRA; NOR";"18";"PROCEEDINGS OF THE ROYAL SOCIETY B-BIOLOGICAL SCIENCES";"";"";"";"";"277";"1701";"3745";"3753";"";"10.1098/rspb.2010.0890";"0962-8452";"";"";"0962-8452";"";"oui";"1";"oui";"1";"Ecologie et évolution, UMR7625";"Institut de biologie de l'Ecole Normale Supérieure (IBENS), UMR8197";"UMR7625";"UMR8197"
"WOS:000286553500008";"";"Quantifying Differences in Circulation Patterns Based on Probabilistic Models: IPCC AR4 Multimodel Comparison for the North Atlantic";"2010";"Rust, HW; Vrac, M; Lengaigne, M; Sultan, B";"Rust, Henning W.; Vrac, Mathieu; Lengaigne, Matthieu; Sultan, Benjamin";"JOURNAL OF CLIMATE Volume: 23 Issue: 24 Pages: 6573-6589 Published: 2010";"English";"Article";"The comparison of circulation patterns (CPs) obtained from reanalysis data to those from general circulation model (GCM) simulations is a frequent task for model validation, downscaling of GCM simulations, or other climate change related studies. Here, the authors suggest a set of measures to quantify the differences between CPs. A combination of clustering using Gaussian mixture models with a set of related difference measures allows for taking cluster size and shape information into account and thus provides more information than the Euclidean distances between cluster centroids. The characteristics of the various distance measures are illustrated with a simple simulated example. Subsequently, a five-component Gaussian mixture to define circulation patterns for the North Atlantic region from reanalysis data and GCM simulations is used. CPs are obtained independently for the NCEP-NCAR reanalysis and the 40-yr European Centre for Medium-Range Weather Forecasts (ECMWF) Re-Analysis (ERA-40), as well as for twentieth-century simulations from 14 GCMs of the Intergovernmental Panel on Climate Change (IPCC) Fourth Assessment Report (AR4) database. After discussing the difference of CPs based on spherical and nonspherical clusters for the reanalysis datasets, the authors give a detailed evaluation of the cluster configuration for two GCMs relative to NCEP-NCAR. Finally, as an illustration, the capability of reproducing the NCEP-NCAR probability density function (pdf) defining the Greenland anticyclone CP is evaluated for all 14 GCMs, considering that the size and shape of the underlying pdfs complement the commonly used Euclidean distance of CPs' mean values.";"";"WEATHER REGIMES; CLIMATE-CHANGE; CLASSIFICATION SCHEME; SYNOPTIC CLIMATOLOGY; GEOPOTENTIAL HEIGHT; CLUSTER-ANALYSIS; ORGANIZING MAPS; VARIABILITY; REANALYSIS; GCM";"Geosciences";"Meteorology & Atmospheric Sciences";"[Rust, Henning W.; Vrac, Mathieu] UVSQ, CEA, CNRS, LSCE IPSL, F-91191 Gif Sur Yvette, France; [Lengaigne, Matthieu; Sultan, Benjamin] Univ Paris 06, LOCEAN, Paris, France";"Rust, HW (reprint author), UVSQ, CEA, CNRS, LSCE IPSL, Bat 701, F-91191 Gif Sur Yvette, France.";"France";"France";"FRA";"12";"JOURNAL OF CLIMATE";"";"";"";"";"23";"24";"6573";"6589";"";"10.1175/2010JCLI3432.1";"0894-8755";"1520-0442";"";"0894-8755 eISSN: 1520-0442";"";"non";"0";"oui";"1";"Institut Pierre-Simon Laplace (IPSL), FR636; Laboratoire d'Océanographie et du Climat : Expérimentations et Approches Numériques (LOCEAN), UMR7159; Laboratoire des sciences du climat et de l'environnement (LSCE), UMR8212";"Institut Pierre-Simon Laplace (IPSL), FR636; Laboratoire d'Océanographie et du Climat : Expérimentations et Approches Numériques (LOCEAN), UMR7159; Laboratoire des sciences du climat et de l'environnement (LSCE), UMR8212";"FR636; UMR7159; UMR8212";"FR636; UMR7159; UMR8212"
"WOS:000283450100009";"20554552";"Bird population trends are linearly affected by climate change along species thermal ranges";"2010";"Jiguet, F; Devictor, V; Ottvall, R; Van Turnhout, C; Van der Jeugd, H; Lindstrom, A";"Jiguet, Frederic; Devictor, Vincent; Ottvall, Richard; Van Turnhout, Chris; Van der Jeugd, Henk; Lindstrom, Ake";"PROCEEDINGS OF THE ROYAL SOCIETY B-BIOLOGICAL SCIENCES Volume: 277 Issue: 1700 Pages: 3601-3608 Published: 2010";"English";"Article";"Beyond the effects of temperature increase on local population trends and on species distribution shifts, how populations of a given species are affected by climate change along a species range is still unclear. We tested whether and how species responses to climate change are related to the populations locations within the species thermal range. We compared the average 20 year growth rates of 62 terrestrial breeding birds in three European countries along the latitudinal gradient of the species ranges. After controlling for factors already reported to affect bird population trends (habitat specialization, migration distance and body mass), we found that populations breeding close to the species thermal maximum have lower growth rates than those in other parts of the thermal range, while those breeding close to the species thermal minimum have higher growth rates. These results were maintained even after having controlled for the effect of latitude per se. Therefore, the results cannot solely be explained by latitudinal clines linked to the geographical structure in local spring warming. Indeed, we found that populations are not just responding to changes in temperature at the hottest and coolest parts of the species range, but that they show a linear graded response across their European thermal range. We thus provide insights into how populations respond to climate changes. We suggest that projections of future species distributions, and also management options and conservation assessments, cannot be based on the assumption of a uniform response to climate change across a species range or at range edges only.";"biological traits; breeding bird monitoring; climate warming; climatic niche; population growth rate; thermal maximum";"EXTINCTION RISK; HABITAT MODELS; DISTRIBUTIONS; DEMOGRAPHY; IMPACTS; ECOLOGY; MONKEYFLOWERS; POLEWARDS; PHENOLOGY; MIGRATION";"Biology & Biochemistry; Environment/Ecology; Plant & Animal Science";"Biology; Ecology; Evolutionary Biology";"[Jiguet, Frederic] Ctr Rech Biol Populat Oiseaux, Museum Natl Hist Nat, UMR MNHN CNRS UPMC 7204, F-75005 Paris, France; [Devictor, Vincent] Univ Montpellier 2, UMR CNRS UM2 5554, Inst Sci Evolut, F-34095 Montpellier, France; [Ottvall, Richard; Lindstrom, Ake] Lund Univ, Dept Anim Ecol, S-22362 Lund, Sweden; [Van Turnhout, Chris] SOVON Dutch Ctr Field Ornithol, NL-6503 GA Nijmegen, Netherlands; [Van Turnhout, Chris] Radboud Univ Nijmegen, Inst Wetland & Water Res, Dept Anim Ecol, NL-6500 GL Nijmegen, Netherlands; [Van Turnhout, Chris] Radboud Univ Nijmegen, Inst Wetland & Water Res, Dept Environm Sci, NL-6500 GL Nijmegen, Netherlands; [Van der Jeugd, Henk] NIOO KNAW, Vogeltrekstn Dutch Ctr Avian Migrat & Demog, NL-6666 GA Heteren, Netherlands";"Jiguet, F (reprint author), Ctr Rech Biol Populat Oiseaux, Museum Natl Hist Nat, UMR MNHN CNRS UPMC 7204, 55 Rue Buffon, F-75005 Paris, France.";"France; Netherlands; Sweden";"France; Netherlands; Sweden";"FRA; NLD; SWE";"47";"PROCEEDINGS OF THE ROYAL SOCIETY B-BIOLOGICAL SCIENCES";"";"";"";"";"277";"1700";"3601";"3608";"";"10.1098/rspb.2010.0796";"0962-8452";"";"";"0962-8452";"";"oui";"1";"oui";"1";"Centre des Sciences de la Conservation (CESCO), UMR7204; Institut des Sciences de l'Evolution de Montpellier (ISEM), UMR5554";"Centre des Sciences de la Conservation (CESCO), UMR7204; Institut des Sciences de l'Evolution de Montpellier (ISEM), UMR5554";"UMR5554; UMR7204";"UMR5554; UMR7204"
"WOS:000288333900005";"";"Thirty-Five-Year Climatic Cycle in Heliogeophysics, Psychophysiology, Military Politics, and Economics";"2010";"Halberg, F; Cornelissen, G; Sothern, RB; Czaplicki, J; Schwartzkopff, O";"Halberg, F.; Cornelissen, G.; Sothern, R. B.; Czaplicki, J.; Schwartzkopff, O.";"IZVESTIYA ATMOSPHERIC AND OCEANIC PHYSICS Volume: 46 Issue: 7 Pages: 844-864 Published: 2010";"English";"Article";"Cycles of about 35 years found in the climate by Bruckner and Egeson were aligned with periodic changes in the length of the solar cycle by the Lockyers. The solar-cycle length and climate were subsequently revisited without reference to any cyclicity or those who discovered it. The descriptive statistics of Bruckner and Lockyer were repeatedly questioned and, with notable exceptions, have been forgotten. Bruckner's data, taken from his summary chart, are shown here for the first time inferentially statistically validated as nonstationary (to the point of intermittency) and, as transdisciplinary, extending from meteorology to 2556 years of international battles; to 2189 years of tree rings; to similar to 900 years of northern lights; to 400 years of economics; to 173 years of military affairs; and to similar to 40 years of helio-, interplanetary- and geomagnetics matching a longitudinal record by a healthy individual who self-measured his heart rate and mental functions (with a 1-min time estimation), among other variables. Space weather, mirrored in the circulation of human blood, can be tracked biologically as a dividend from self-assessed preventive health care including the automatically and ambulatory-recorded heart rate and blood pressure for detecting and treating heretofore ignored vascular variability disorders. A website providing free analyses for anyone (in exchange for their data) could serve any community with computer-savvy members and could start focusing the attention of the population at large on problems of societal as well as individual health. Space weather was found to affect the human cardiovascular system, and it has been supposed that data on space weather can be inversely assimilated from biological self-monitoring data.";"35-year cycle; climatic changes; multidisciplinary data; automatic system of self-assessed health care";"SOLAR-CYCLE; CHRONOMICS; CHRONOASTROBIOLOGY; VARIABILITY; RHYTHMS; LENGTH";"Geosciences; Plant & Animal Science";"Meteorology & Atmospheric Sciences; Oceanography";"[Halberg, F.; Cornelissen, G.; Sothern, R. B.; Schwartzkopff, O.] Univ Minnesota, Halberg Chronobiol Ctr, Minneapolis, MN 55455 USA; [Czaplicki, J.] Univ Toulouse, CNRS, Inst Pharmacol & Struct Biol, F-31077 Toulouse, France";"Halberg, F (reprint author), Univ Minnesota, Halberg Chronobiol Ctr, 420 Delaware St SE, Minneapolis, MN 55455 USA.";"France; United States";"France; United States";"FRA; USA";"0";"IZVESTIYA ATMOSPHERIC AND OCEANIC PHYSICS";"";"";"";"";"46";"7";"844";"864";"";"10.1134/S0001433810070054";"0001-4338";"";"";"0001-4338";"";"oui";"1";"oui";"1";"Institut de pharmacologie et de biologie structurale (IPBS), UMR5089";"Institut de pharmacologie et de biologie structurale (IPBS), UMR5089";"UMR5089";"UMR5089"
"WOS:000287429500009";"";"Agriculture in upland regions is facing the climatic change: transformations in the climate and how the livestock farmers perceive them; strategies for adapting the forage systems";"2010";"Seres, C";"Seres, C.";"FOURRAGES Issue: 204 Pages: 297-306 Published: 2010";"French";"Article";"While nowadays the climatic change seems to be generally acknowledged, there still remain large uncertainties on its effects on the local scale. The mountain zones, which a priori are very vulnerable, are not affected with the same intensity by the changes, and the perception of the changes by the farmers often depends on the exposure of their land. Since the drought of 2003, the farmers have been adjusting their systems according to various strategies, and with an amplitude depending on the intensity of their perception of the climatic change. These adjustments are complex to operate; certain of the factors involved are internal to the farms (willingness of the farmers to accept the changes, flexibility of the farms' workings) and other are external. Nevertheless, there exist certain tools, specific to the upland zones (mountain pastures and AOC, i.e. Appellation d'Origine Controlee, meaning Official Label of Origin) with interesting possibilities.";"Agriculture; Alps; Appellation d'Origine Controlee (Official Label of Origin); change in time; climatic change; climatic factor; environmental factor; farmers' pratices; forage production; forage system; grassland; highland; Jura; sociology; survey; upland pasture";"";"Plant & Animal Science";"Agriculture, Dairy & Animal Science";"Suaci Alpes Nord GIS Alpes Jura, Maison Agr & Foret, F-73190 St Baldoph, France";"Seres, C (reprint author), Suaci Alpes Nord GIS Alpes Jura, Maison Agr & Foret, 40 Rue Terraillet, F-73190 St Baldoph, France.";"France";"France";"FRA";"0";"FOURRAGES";"";"";"";"";"";"204";"297";"306";"";"";"0429-2766";"";"";"0429-2766";"";"non";"0";"non";"0";"";"";"";""
"WOS:000285814000001";"";"Marseilles tide-recorder series Sea surface temperature measurements from 1895 to 1955 A correction";"2010";"Romano, JC; Lugrezi, MC; Durand, D; Durand-Le-Breton, F";"Romano, Jean-Claude; Lugrezi, Marie-Catherine; Durand, Dominique; Durand-Le-Breton, Francoise";"COMPTES RENDUS GEOSCIENCE Volume: 342 Issue: 12 Pages: 873-880 Published: 2010";"French";"Article";"In 2007 a daily temperature series which has been collected from 1885 to 1967 at the Marseilles tide recorder was published here Upon the wadable information provided by the data managing office they were considered as sea-surface temperatures Unfortunately they were not but air temperature inside the building In the present paper the authors correct this error by studying the true seawater temperature series which had been dug out after the publication of the precedent paper The study of this slightly shorter series (1895-1956) leads to close conclusions Along these 61 years the warming trend of the surface seawater rises to +1 6 degrees C to +1 3 C if only January to May and December are selected and +2 2 C during the June to November period In the first half part of the series (1895-1925) the average value of each month distributions (except January) and annual minimal (except 1956) are significantly lower than along the second (1925-1956) (C) 2010 Academie des sciences Published by Elsevier Masson SAS All rights reserved";"Sea surface temperatures; North western Mediterranean; Historical series; Marseilles tide recorder; Global warming";"MORTALITY";"Geosciences";"Geosciences, Multidisciplinary";"[Romano, Jean-Claude; Lugrezi, Marie-Catherine] Univ Pascal Paoli, Ctr Sci Vignola, UMR CNRS Sci Environm SPE, F-20000 Ajaccio, France";"Romano, JC (reprint author), Univ Pascal Paoli, Ctr Sci Vignola, UMR CNRS Sci Environm SPE, F-20000 Ajaccio, France.";"France";"France";"FRA";"1";"COMPTES RENDUS GEOSCIENCE";"";"";"";"";"342";"12";"873";"880";"";"10.1016/j.crte.2010.09.007";"1631-0713";"";"";"1631-0713";"";"non";"0";"oui";"1";"Sciences Pour l'Environnement (S P E), UMR6134";"Sciences Pour l'Environnement (S P E), UMR6134";"UMR6134";"UMR6134"
